company_name,job_link,label,city,job_name,job_description,job_requirements,additional_info,company_info,job_type
Kinetik Digital Recruitment,https://eg.indeed.com/cmp/Kinetik-Digital-Recruitment?campaignid=mobvjcmp&from=mobviewjob&tk=1hip68j2cgpeg801&fromjk=563e6b6bab1b7f7b,data science,Cairo,Technical Product Owner,"Act as the primary liaison between product management and the software development teams, ensuring clear communication and collaboration.Manage and prioritize the product backlog to reflect the needs of the business while considering technical feasibility.Work closely with the development team to define clear user stories and acceptance criteria, ensuring development efforts are in line with the product's vision and strategy.Conduct comprehensive user research to glean customer insights and identify opportunities for product enhancement.Foster a collaborative environment with design, engineering, and quality assurance teams to guarantee the successful rollout of products.Monitor, analyze, and report on product performance metrics to track alignment with business objectives.Keep abreast of industry trends and technological advancements to drive continuous improvement in the product offering.","Technical Proficiency: A thorough understanding of the technical aspects of software development and architecture.Agile Expertise: Deep knowledge of Agile methodologies, with the ability to apply them effectively in product development.Analytical Skills: Strong capability to analyze complex data and translate user insights into actionable product improvements.Project Management: Proven experience in managing multiple projects, with a keen ability to prioritize tasks effectively.Communication: Excellent interpersonal and communication skills, necessary for working with diverse teams and stakeholders.Leadership: Demonstrated leadership in guiding teams and driving product initiatives forward.","Bachelor's degree in Computer Science, Engineering, or a related technical field.At least 3 years of professional experience as a Product Owner in a technical or software development environment.Proficient understanding of the software development lifecycle and modern software development practices.Practical experience with Agile development methodologies and tools such as Jira.","Job Description:We are on the lookout for a dynamic Technical Product Owner with a robust background in software development and a comprehensive understanding of product development's technical facets. This role is perfect for someone passionate about serving as the liaison between product management and development teams, with the acumen to prioritize work based on both business and technical considerations.Key Responsibilities:Act as the primary liaison between product management and the software",Full-time
Henkel,https://eg.indeed.com/cmp/Henkel?campaignid=mobvjcmp&from=mobviewjob&tk=1hip68mgjissp800&fromjk=5eef8b9a89403074,data science,Cairo,Private Cloud Engineer ‏ (1 Year Contract),"Manages and support Henkel's Infrastructure Environment including Data Center and Cloud Platforms on a project basis - 1 year contract.Configure and manage virtualization technologies, including virtual machines, and clusters.Develop and implement automation scripts and tools to streamline operational tasks and improve efficiency.Ensure compliance with security and regulatory requirements in the private cloud environment.Provide technical support to resolve issues related to virtualization, automation, and private cloud infrastructure.Implement backup and disaster recovery solutions for virtual machines and private cloud infrastructure.","Bachelor's degree in Computer Science, Information Systems, Software Development, IT Engineering or any relevant studies1-3 years of relevant work experienceFluent English speaker with excellent communication skills and teamwork abilitiesProficient user of MS Office applications (Word, Excel, and PowerPoint)Knowledge of VmWare, Network Security, LAN/WAN NetworksPreferred knowledge of Virtualization; Scripting, Cloud Platforms, Ansible, Terraform, Microsoft Azure",,"At Henkel, you can build on a strong legacy and leading positions in both industrial and consumer businesses to reimagine and improve life every day. If you love challenging the status quo, join our community of 50,000 pioneers around the globe. The teams in our corporate functions enable the best in our dynamic businesses and in our people to maximize our company’s potential. With our leading brands, our cutting-edge technologies and our disruptive solutions, you will have countless opportunities to explore new paths and develop your skills. Grow within our future-led businesses, our diverse and vibrant culture and find a place where you simply belong. All to leave your mark for more sustainable growth.Dare to make an impact?YOUR ROLEManages and support Henkel's Infrastructure Environment including Data Center and Cloud Platforms on a project basis - 1 year contract.Configure and manage virtualization technologies, including virtual machines, and clusters.Develop and implement automation scripts and tools to streamline operational tasks and improve efficiency.Ensure compliance with security and regulatory requirements in the private cloud environment.Provide technical support to resolve issues r",Full-time
Reliance Health,https://eg.indeed.com/cmp/Reliance-Health?campaignid=mobvjcmp&from=mobviewjob&tk=1hip68psv2eh5000&fromjk=4f21d0e7fe659739,data science,Cairo,Director of Data Science & Business Intelligence,"Build & scale our data science team, ultimately helping our business make decisions betterCreate a data science roadmap that aligns with key areas of the business and unlocks valueCreate and deliver a business intelligence roadmap that scales our infrastructure, reporting, and data model capabilitiesOutline the customer journey, and identify levers the business can pull to delight our customers and create sticky experiencesCreate multivariate models that showcase the key drivers of customer retention and churnCollaborate cross-functionally with analytics teams, engineering teams, and groups of passionate stakeholders dedicated to improving our customer experienceDistill our knowledge of the consumer into playbooks, and data visualizations effectively putting knowledge into action that helps out businesses make decisions better","Minimum 7 years of experience as a data scientist, with particular focus on machine learning and NLP.Tertiary education from a recognised institution, in a quantitative field. A Master's degree is preferred.Minimum of 3 years managerial experienceExperience with analytics software tools or languages (R, Python, etc.) and machine learning techniques is a mustWorking knowledge of visualization platforms and customization (Power BI, Tableau etc) is a mustMust be a highly analytical individual with a strong grasp of modern statistical methodsExperience with full lifecycle data science projects is a mustExperience with medical data is an added advantageAbility to work independently in a fast-paced environmentExcellent oral and written communication skills",Work alongside & learn from best-in-class talent,"As Director of Data Science & Business Intelligence, you will be empowered to build an enterprise Data Science and BI capability. This role will be critical in scaling our BI infrastructure and unlocking the power of data science in creating stickier experiences for our customers. Your knowledge of statistics, BI infrastructure, and analytics methods combined with your strong management and communication skills will determine how we evolve key areas of our business. In this role, you will be a player-coach, fully remote, and report to senior leaders in the Analytics and Finance Organization.ResponsibilitiesBuild & scale our da",Full-time
ICARDA,https://eg.indeed.com/cmp/Icarda?campaignid=mobvjcmp&from=mobviewjob&tk=1hip68t2lg3ml800&fromjk=49296cec0178facc,data science,Cairo,Monitoring,"Support the formulation and review of institutional- and project-level results frameworks, including logical frameworks, theories of change, impact pathways, indicators etc.Participate in the development of methodologies for outcome monitoring, including but not limited to the development of excel-based models.Support the user-based testing and piloting of new features to enhance web-based MEL platform (HTTP: //mel.cgiar.org).Configure projects in the web-based MEL Platform.Support research studies through the development of data collection tools and program the same in mobile data collection platforms such as ODK, ONA, CSPro, KOBOToolbox, etc.Provide training on the use of the developed data collection tool(s) and manage the resultant data.Support ICARDA research programs in the development and review of Plans of Work Budget and reporting processes.Support the identification, documentation and sharing/ dissemination of lessons learned.Support evaluation processes initiated by ICARDA or partner/associated projects and research programs.Undertake other tasks relevant for the efficient and effective running of the monitoring, evaluation and learning function, as may be assigned by the MEL Specialist.","Bachelor’s degree in Agricultural Economics, Water/Irrigation Engineering, Rangeland Ecology and Conservation, Plant Breeding, Livestock Management, Soil Science, or related disciplinesPostgraduate or short course on Monitoring and Evaluation.Up to 2 years of work experience in monitoring and evaluation with an organization with a mandate similar to ICARDA’s.Excellent written and oral communication skills in English.Strong computer skills, including in using MS Office, and familiarity with web-based platforms.Knowledge of or experience working on international development issues, especially in areas related to ICARDA’s mandate.Demonstrated ability to consistently meet deadlines and manage time well.Professional level of attention to detail, accuracy of work & ability to multitask.Ability to work in interdisciplinary & multicultural teams.","Master’s degree in Monitoring and Evaluation, Agricultural Economics, Water/Irrigation Engineering, Rangeland Ecology and Conservation, Plant Breeding, Livestock Management, Soil Science, or related disciplines3-5 years of work experience in monitoring and evaluation with an organization with a mandate similar to ICARDA’s.Excellent written and oral communication skills in an additional international language other than EnglishKnowledge of the CGIAR, its research portfolio and Centers.","Reporting to:Monitoring, Evaluation and Learning (MEL) SpecialistLocation:RemotelyMain Purpose of the positionTo ensure that it is fit for purpose, through enhanced organizational effectiveness, ICARDA adopted a results-based management (RBM) system, mainstreamed across and beyond the organization, under the custodianship of the ICARDA MEL team. The Monitoring, Evaluation and Learning (MEL) team at ICARDA is comprised of the Monitoring and Evaluation (M&E) sub-team, the Knowledge Management (KM) sub-team, the Data Management (DM) sub-team and the Research Software Development (RSD) sub-team. The ICARDA MEL team staff are located in several countries across the globe and work collaboratively with MEL, Data and Knowledge Management teams from the CGIAR System, other CGIAR centers and Research Programs, and non-CGIAR entities.To further champion results-based management at ICARDA, associated CGIAR centers and research programs, ICARDA seeks to hire a self-driven and competent ‘MEL Research Fellow’. The selected individual, under the guidance of the MEL Specialist, will contribute to the design and enhancement of Monitoring, Evaluation and Learning (MEL) systems and tools.“This position is to identify a replacement for Jake Carampatana who tragically passed away on 12 August 2023. Jake Carampatana was a valued member of the ICARDA MEL team from 2019 until August 2023. He was assigned to support planning, coordinating, monitoring and reporting of the CGIAR Research Program on Grain Legumes and Dryland Cereals (CRP-GLDC ) and later the Accelerated Breeding Initiative (ABI).Jake was friendly, intelligent and a good colleague committed to his work.”About ICARDA:The International Center for Agricultural Research in the Dry Areas (ICARDA) is a treaty-based international non-profit research organization supported by CGIAICARDA’s mission is to reduce poverty, enhance food, water, and nutritional security, as well as environmental health in the face of global challenges including climate change. We do this through innovative science, strategic partnerships, linking research to development and capacity development that take into account gender equality and the role of youth in transforming the dry areas. ICARDA works in partnership with governments, universities, civil society, national agricultural research organization, other CGIAR Research Centers, and the private sector. With its temporary Headquarters in Beirut, Lebanon, ICARDA operates in regional and country offices across Africa, Asia and the Middle East. For more information: www.icarda.orgAll CGIAR Centers are currently engaged into a reform process (“One CGIAR’”) that will help ICARDA and CGIAR achieve better impact through more strategically integrated research, unified governance, an integrated structure and new research modalities across participating Research Centers. This transformation is supported by CGIAR donors who have committed to increased funding as a result of these reforms.Main responsibilities:Support the formulation and review of institutional- and project-level results frameworks, including logical frameworks, theories of change, impact pathways, indicators etc.Participate in the development of methodologies for outcome monitoring, including but not limited to the development of excel-based models.Support the user-based testing and piloting of new features to enhance web-based MEL platform (HTTP: //mel.cgiar.org).Configure projects in the web-based MEL Platform.Support research studies through the development ",Full-time
CEQUENS,https://eg.indeed.com/cmp/Cequens?campaignid=mobvjcmp&from=mobviewjob&tk=1hip6908ujkao802&fromjk=deff70f6c2626e29,data science,Cairo,Product Owner,"Working with the Product Manager in defining and communicating the product vision, strategy, and roadmap to align with the company's goals.Conduct market research and competitor analysis to identify emerging trends and opportunities.Collaborate with stakeholders to gather requirements and understand customer needs.","Develop and maintain a product backlog, ensuring it is well-defined, prioritized, and aligned with the product vision.Work closely with the development team to create and refine user stories, acceptance criteria, and release plans.Break down complex requirements into actionable tasks and ensure clear communication across teams.","Collaborate with cross-functional teams, including design, engineering, marketing, and sales, to ensure a cohesive product strategy.Facilitate effective communication and collaboration among team members, ensuring a shared understanding of goals and objectives.Act as a bridge between stakeholders and development teams, conveying product requirements and gathering feedback.","Position OverviewAs a Product Owner, you will be responsible for ensuring the successful development and delivery of our products. You will work closely with stakeholders, including customers, product managers, executives, and development teams, to define the product vision, set priorities, and drive the execution of product roadmaps. Your primary goal will be to maximize the value of our products and enhance the overall customer experience.Responsibilities Product Strategy and Vision:Working with the Product Manager in defining and communicating the product vision, strategy, and roadmap to align with the company's goals",Full-time
PwC,https://eg.indeed.com/cmp/Pwc?campaignid=mobvjcmp&from=mobviewjob&tk=1hip69c5bisvj800&fromjk=e64ac4f03d0a0910,data science,Cairo,ETIC,"Conduct end-to-end, web application, network/infrastructure penetration testing exercises on client assets/infrastructure and report findings and recommendations effectively.Additionally, the role involves conducting mobile apps penetration testing and source code reviews to identify security weaknesses in the application source code, leveraging manual and automated tools and effectively reporting them to development teams, red-teaming exercises, including defining attack scenarios, conducting attack simulations that include social engineering, lateral movement, evasion techniques, obfuscation in alignment with cyber kill-chain and MITRE ATT&CK.Present test findings, risks and conclusions to technical and non-technical audience.Communicate effectively (both verbal and writing) with cybersecurity team, IT personnel, and executive management.","Years of experience: 3+ years of experience in cybersecurity penetration testing.University degree, ideally in the fields of Computer and Information Science, Computer Engineering, Information Cyber Security.Experience in 2 or more of the following areas of penetration testing: Web applications, networks, red teaming, mobile applications, source code review.Certifications in cybersecurity (OSCP, OSEP, eWPTX, GPEN, GXPN).Good understanding of emerging cybersecurity technologies and standards.Experience in VAPT tools such as burpsuite, metasploit framework, Kali Linux, Acunetix, Nessus, etc..Achievement oriented with the ability to be flexible and adaptive on a daily basis.Good organizational skills, having the ability to prioritize workload whilst being resilient and able to cope well under pressure and meet tight deadlines.Good problem-solving skills with a structured thinking process.Good time-management and organizational skills.Language Skills: Excellent communication skills (verbal and written) in English and Arabic.The ability and willingness to travel to KSA is a must.",Practical experience in delivering ethical hacking servicesExperience in Consulting or in working within multinational environmentsExcellent communication and presentation skillsHigh level of customer orientation and a convincing demeanourAbility to work within a fast-paced &amp; unstructured environment. Must be able,"Line of ServiceAdvisoryIndustry/SectorTechnologySpecialismAdvisory - OtherManagement LevelSenior AssociateJob Description & SummaryAbout PwC ETIC - Egypt Technology and Innovation CentrePwC is opening a new Technology &amp; Innovation Center in Cairo that willdeliver high quality technology solutions to consulting Clients across theglobe. The Centre will provide a broad suite of skills and services to ourclients, ranging from Packaged Applications such as SAP &amp; Oracle, toCyber Security, Data Analytics, Custom Development and Cloud servicesutilising AWS, Azure and Google, as well as expanding our existingManaged Services capabilities.The centre is looking to expand rapidly and we are looking forenthusiastic self-starters with a passion for technology and clientdelivery to help shape and form this new venture.Ethical Hacking Senior AssociateAbout PwC ETIC - Egypt Technology and Innovation Centre:PwC ETIC (Egypt Technology & Innovation Center) in Cairo is delivering high quality technology solutions to consulting clients across the globe. The centre provides a broad suite of skills and services to our clients, ranging from packaged applications such as SAP & Oracle, to Cyber Security, Data Analytics, Custom Development and Cloud Services utilizing AWS, Azure and Google, as well as expanding our existing Managed Services capabilities.The centre is looking to expand rapidly and we are looking for enthusiastic self-starters with a passion for technology and client delivery to help shape and form this new venture.Core Responsibilities:Conduct end-to-end, web application, network/infrastructure penetration testing exercises on client assets/infrastructure and report findings and recommendations effectively.Additionally, the role involves conducting mobile apps penetration testing and source code reviews to identify security weaknesses in the application source code, leveraging manual and automated tools and effectively reporting them to development teams, red-teaming exercises, including defining attack scenarios, conducting attack simulations that include social engineering, lateral movement, evasion techniques, obfuscation in alignment with cyber kill-chai",Full-time
PwC,https://eg.indeed.com/cmp/Pwc?campaignid=mobvjcmp&from=mobviewjob&tk=1hip69fd5icbi800&fromjk=93e877c4a466bd3e,data science,Cairo,ETIC,"PowerBI, Tableau, QlikSense, Looker, Foundry or equivalentSQL, PowerQuery; Alteryx or equivalentMinimum 3 years of experience as Dashboards and Reports developer using Power BI or equivalent BI toolMinimum 2 years of experience with the following tools: Azure Data Platform tools, SQL DB, and Power BIAcquiring data and transforming it for reporting in PowerBI and PowerQueryCreating calculated, restricted and derived measures in PowerQuery and PowerBI, as well as understanding when to use which approachCreating appealing and insightful visualizations and interactive reports, filters in Power BI using information design principlesCreation of relational data models based on reporting requirements and raw base dataStandard approaches for data cleansing and to ensuring data qualityIdentification and definition of rules within an ETL process to harmonize, aggregate, filter and transform data so that it can be used for defined reporting goalsUnderstanding of statistical modelling, machine learning, or data mining, text mining concepts and a track record of solving problems with these methods to deliver rapid business insightProven programming experience in one of Python, R, Go, SQL or similarProven experience using ExcelStrong business acumen in relation to analytics, having had experience within at least one business area function (e.g marketing, sales, finance, workforce, procurement etc.)Proven experience in requirements gathering and translationExtensive experience in handling large, complex data setsAnalysis of business functionality and needs; translating them into technical requirements and solution designsExcellent communication, relationship skills and a strong team playerProven ability to transfer technical knowledge to clients and colleaguesPassionate about analytics and insight, including staying up-to-date with the latest trends and technologies","Enhancing PowerBI reports with row-level security and configuring this functionalityData Analysis Expressions (DAX)Creating advanced data processing workflows in Alteryx, with skills in the tool categories not mentioned above (e.g. Predictive, Prescriptive, Spatial, Demographic Analysis)Publishing of workflows to Alteryx Server and scheduling workflowsCreating Alteryx MacrosCreating SnapLogic pipelinesWorking with DataBricks",Microsoft Power BI Certification is neededTableau Certification is a plusCelonis certification is a plusAlteryx Certification is a plus,"Line of ServiceAdvisoryIndustry/SectorTechnologySpecialismAdvisory - OtherManagement LevelSenior AssociateJob Description & SummaryA career within Data and Analytics services will provide you with the opportunity to help organisations uncover enterprise insights and drive business results using smarter data analytics. We focus on a collection of organisational technology capabilities, including business intelligence, data management, and data assurance that help our clients drive innovation, growth, and change within their organisations in order to keep up with the changing nature of customers and technology. We make impactful decisions by mixing mind and machine to leverage data, understand and navigate risk, and help our clients gain a competitive edge.You’ll be joining our Data engineering, Reporting and Analytics practice, a core part of our Technology, Data & Analytics business unit. We support our clients in delivering a variety of transformation projects across the commercial sector from defining data strategies to helping architect, design and implement modern data and analytics solutions using the latest cloud technologies.The role will provide you with an opportunity to work across a portfolio of clients, with a focus on large and complex organisations.You will work in the team that reports to the Data Analytics delivery service leadership team and will be an integral part of the team based in Cairo, as well as those delivering client transformation programmes across the PwC Global Network, including the UK, Germany and Middle East.Essential skills & attributes:+4 years of experience in a reporting and analytics role, extensive experience in reporting & analytics tools including:PowerBI, Tableau, QlikSense, Looker, Foundry or equivalentSQL, PowerQuery; Alteryx or equivalentMinimum 3 years of experience as Dashboards and Reports developer using Power BI or equivalent BI toolMinimum 2 years of experience with the following tools: Azure Data Platform tools, SQL DB, and Power BIAcquiring data and transforming it for reporting in PowerBI and PowerQueryCreating calculated, restricted and derived measures in PowerQuery and PowerBI, as well as understanding when to use which approachCreating appealing and insightful visualizations and interactive reports, filters in Power BI using info",Full-time
