company_name,job_link,label,city,job_name,job_description,job_requirements,additional_info,company_info,job_type
MigrationIT,https://eg.indeed.com/cmp/Migrationit?campaignid=mobvjcmp&from=mobviewjob&tk=1hip6lft4iemi801&fromjk=d1bffb9a335f7865,data science,Cairo,NOC Excellence (Capacity & Performance),IndustryBankingFieldInfrastuctureField / AreaNetworksJob CategoryNetwork EngineeringWork Experience1-3 yearsCityCairoState/ProvinceCairoCountryEgyptZip/Postal Code11311,"Define capacity measurements and requirements for all production services/systems.Development and execution of capacity and performance plans and provide capacity solutions in order to achieve the service forecast.Analyze business forecasts to get the trends of the services and decide if any expansion is needed.Produce weekly/Monthly Capacity Management Reports.Own configuration management and capacity management processes.Support and maintain IT configuration management databases (CMDB), and Ensure that the CMDB is managed and maintained with the highest degree of accuracy, and ensure that audits are performed on a regular basis.Accountable for building and publishing the service catalog and responsible for incorporating new services into the service catalog and service delivery model.Design and implement end-to-end performance monitoring for all production services/systems and infrastructure to improve detection and avoidance of issues.Integrate APM platform with all services and infrastructure components.Provide technical and functional support for APM, and capacity management platforms.Implement proactive identification of performance degradation for all services, infrastructure and platforms.Continuous collaboration with services' and applications' owners regarding performance issues, scheduled service improvements and planned activities.Build, maintain and automate disaster recovery procedure for all production services/systems.","Bachelor’s degree in Computer Science or 3 years of relevant experience.Experience with best-in-class capacity, monitoring, data analysis, and visualization tools.Configuration management, Application support, Scripting/programming skills.Relevant professional experience in Capacity, Configuration, Incident and Problem Management.ITIL and other IT service management processes knowledge.Strong operational understanding of information technology.Experience of developing IT architecture within transformation.","Job InformationIndustryBankingFieldInfrastuctureField / AreaNetworksJob CategoryNetwork EngineeringWork Experience1-3 yearsCityCairoState/ProvinceCairoCountryEgyptZip/Postal Code11311Job DescriptionLead capacity planning, end2end performance function responsible for measuring and maintaining production services/systems capacity, analyzing the effect of business forecast on the system’s capacity, Setting E2E monitoring strategy across all production services/systems, building proactive monitoring solutions to detect service instability before impacting customers, improving service avail",Full-time
PwC,https://eg.indeed.com/cmp/Pwc?campaignid=mobvjcmp&from=mobviewjob&tk=1hip6lj53isst800&fromjk=ffa022cb249a23f0,data science,Cairo,ETIC,"Collaborate with clients and project teams to gather and analyze business and systems requirements specifications.Evaluate clients’ existing technology landscape, technical environment, and frameworks to identify areas for improvement and/or optimization.Develop, review, and maintain Solution Architecture Definition models and documentation.Design and lead the implementation of complex IT solutions and products.Provide technical leadership and guidance to project teams throughout the development lifecycle.Stay up-to-date with the latest technology and make recommendations for improvement where necessary.","Bachelors or Masters degree in Computer Engineering/ Computer ScienceMinimum 10+ years of experience in IT industryMinimum 3+ years of experience in designing and implementing solution architecture for multi-domain solutions in Cloud, Full Stack,Enterprise Integration, Data Platform, AI, Data Analytics, Cybersecurity and Packaged Applications (ERP, CRM …etc)Minimum 3+ years of experience in Leading teams (overseeing several teams) delivering end to end IT solutionsProficiency in C# programming languages and .NET frameworkChampion for software engineering best practiceExperience with Cloud technologies - Microsoft Azure SME / DevOps / SI on Amazon Connect / Salesforce / MS Dynamics is a plusExcellent problem-solving and analytical skillsStrong communication and interpersonal skills, with the ability to effectively collaborate with cross-functional teams and stakeholdersAbility to work in a fast-paced environment and manage multiple projects and priorities",,"DescriptionEstablished in the region for 40 years, PwC has around 8,000 people in 12 countries across the region: Bahrain, Egypt, Iraq, Jordan, Kuwait, Lebanon, Libya, Oman, the Palestinian territories, Qatar, Saudi Arabia and the United Arab Emirates.Our regional team operates across the Middle East bringing international experience delivered within the context of the region and its culture. We can bring the collective knowledge and experience of more than 328,000 people across the entire global PwC network in advisory, assurance and tax to help you find the value you are looking for.Line of ServiceAdvisoryIndustry/SectorTechnologySpecialismAdvisory - OtherManagement LevelSenior ManagerJob Description & SummaryA career in our Emerging Solution Architecture practice, within Enterprise Architect services, will provide you with the opportunity to bring our clients a competitive advantage through defining their technology objectives, assessing solution options, and devising architectural solutions that help them achieve both strategic goals and meet operational requirements. We help build software and design data platforms, manage large volumes of client data, develop compliance procedures for data management, and continually researching new technologies to drive innovation and sustainable change.Our team helps our clients plan, align, and enable relationships among all work streams of the business. As part of our team, you’ll help with technology strategy, enterprise architecture delivery, and specific software development for our clients needs.PwC ETIC (Egypt Technology & Innovation Center)in Cairo is delivering highquality technology solutions to consulting clients across the globe. The centreprovides a broad suite of skills and services to our clients, ranging from CloudServices utilizing AWS, Azure and Google cloud platforms to ArtificialIntelligence, Data Analytics, Cyber Security and Enterprise Applications suchas SAP, Oracle and Salesforce, as well as expanding our existing ManagedServices capabilities.As a fast-growing team, we are looking for an innovative, dynamic, andproactive Solution Architect who has a passion for shaping and realizing PwCvision for our clients’ success. In today's rapidly evolving technologicallandscape, the role of solution architecture is becoming increasingly crucial. Asbusinesses strive for digital transformation and seek innovative ways to solvecomplex problems, solution architects play a pivotal role in designing andimplementing effective solutions.At PwC ETIC, we have an increasing demand and opportunities for SolutionArchitects which will provide you with the opportunity to step up and playsignificant and rewarding roles in an innovation driven environment. If you arepassionate about the role we would be delighted to hear from you.Your Responsibilities:Collaborate with clients and project teams to gather and analyze business and systems requirements specifications.Evaluate clients’ existing technology landscape, technical environment, and frameworks to identify areas for improvement and/or optimization.Develop, review, and maintain Solution Architecture Definition models and documentation.Design and lead the implementation of complex IT solutions and products.Provide technical leadership and guidance to project teams throughout the development lifecycle.Stay up-to-date with the latest te",Full-time
Pfizer,https://eg.indeed.com/cmp/Pfizer?campaignid=mobvjcmp&from=mobviewjob&tk=1hip6lme32ieb002&fromjk=eec3156ba0e2516c,data science,Cairo,Country Brand Lead ,"Develop strategic marketing plans to accelerate launches, uptake and access to new/existing assets.Develop country Op Plan; revenue targets, brand A&P and FTE allocations with Category LeadManagement of different brands life cycles within the category portfolio.Identify issues, opportunities, MWMs and CSF per brand or TA.Tailor global brand strategies to local market needs and define local priorities for the brand.Define potential target customer segments and develop positioning of different assets.Lead the development of Brand Plan/SPICE & tactical matrix in collaboration with CBM.Ensure that customer and patient insights as well as market issues are well understood and processed into the local and regional brand plansDrive execution of brand strategy in country - lead implementation of key brand programs.Select best-fitting modules from regional content; translates and trans-create brand materials.Coordinate with Medical and FF colleagues in designing value-added customer programs and managing relations with key stakeholders to ensure strong and consistent Pfizer engagement.","Partner with Category Lead to ensure alignment with overall brand strategy and incorporation of market feedbackWork in collaboration with regional & global cross functional teams in order to coordinate the activities of members of these teams as appropriate to achieve brand objectives.Cross-functional brand leadership – across Field Force, Account management, medical, legal, regulatory, Health and value, supply etc. Train Field Force on product positioning and prioritization.Partner with Medical to educate KOLs on emergent medical research and differentiated product attributesProvide local insights and brand feedback to Regional Therapeutic Area Lead (RTAL) / Brand Implementation LeadContributing in talent planning, team development and CBM coaching.","Accountable for the planning, spending & controlling of budgets agreed for TA of responsibility & developing regular forecast updates to aid financial planning.Oversee sales and forecasting, provide country input into overall Africa Middle East forecasts.Forecast revenue and Opex of assigned brands and track brand performance and progress towards target (LE exercises)Meet/exceed local revenue and profitability objectivesReview pricing and make recommendations to ensure strategic pricing to leverage opportunities in all sectors; working closely with Access lead","CBL (Country Brand Lead)POSITION SUMMARYOwns portfolio strategies for the country and leads the cross functional team to ensure marketing excellence of designated brands throughout their life cycles.Uses market insights to develop brands strategies, promotional messages and programs to ensure launch successes, drive growth, maximize portfolio value, and ensure the realization of revenues and profitability objectives. Ensure that the strategies encompass all sectors (private & public), channels of distribution, and customers within the market.POSITION RESPONSIBILITIESStrategy development & PlanningDevelop strategic marketing plans to accelerate launches, uptake and access to new/existing assets.Develop country Op Plan; revenue targets, brand A&P and FTE allocations with Category LeadManagement of different brands life cycles within the category portfolio.Identify issues, opportunities, MWMs and CSF per brand or TA.Tailor global brand strategies to local market needs and define local priorities for the brand.Define potential target customer segments and develop positioning of different assets.Lead the development of Brand Plan/SPICE & tactical matrix in collaboration with CBM.Ensure that customer and patient insig",Full-time
MigrationIT,https://eg.indeed.com/cmp/Migrationit?campaignid=mobvjcmp&from=mobviewjob&tk=1hip6lplog3ml800&fromjk=b1f00b2592637a9d,data science,Cairo,Application Support Engineer,IndustryIT ServicesFieldApplications & DataField / AreaBusiness Analysis & SupportJob CategoryApplication Support AnalystWork Experience1-3 yearsCityCairoState/ProvinceAI QahirahCountryEgyptZip/Postal Code12577,"Have a good understanding of ERP Implementation and applications.Workflow & internal process automation prospective understanding.Support application users in the system issues to facilitate their role in the system smoothly.Proven track record of application and financials ERP support, deployment, patching and issue resolution.Good resolution for mapping between business needs requirements and the system.Intermediate level of knowledge of databases maintenance and administration, monitoring, testing and procedures, Performance & tuning, Backup & Recovery.Ability to gather requirements and analyze them effectively to give a complete description of the solution or work around.Superior Root Cause Analysis for the technical problems in the minimum period of time to minimize the service downtime and enhance the operations SLA.","Bachelor’s degree in a relevant discipline, preferably, Computer Science.2+ years of experience in application and database support.A good application implementation record.Ability to diagnose & address application issues.Ability to build constructive relationships with clients.",Job InformationIndustryIT ServicesFieldApp,Permanent
CIT VeriCash,https://eg.indeed.com/cmp/Cit-Vericash?campaignid=mobvjcmp&from=mobviewjob&tk=1hip6lvrcj6e8800&fromjk=7c683be0231028e8,data science,Cairo,Principal / Specialist Java Developer,Software DevelopmentDeliver releases within stipulated timeframes and according to design and specification.Communicate effectively current status of code deliverables and raise risks early that timeframes could be missed.Develop product/solution logic within an iterative development lifecycle.Maintain and modify existing applications ensuring adherence to standards.Push and pull data interfaces using the latest web and data sharing technologies and project needsLearn quickly and with passion extend their coding skill set as the project requires.,Deliver releases within stipulated timeframes and according to design and specification.Communicate effectively current status of code deliverables and raise risks early that timeframes could be missed.Develop product/solution logic within an iterative development lifecycle.Maintain and modify existing applications ensuring adherence to standards.Push and pull data interfaces using the latest web and data sharing technologies and project needsLearn quickly and with passion extend their coding skill set as the project requires.,Work closely with other teams to ensure product/solution readiness for release,,Full-time
PwC,https://eg.indeed.com/cmp/Pwc?campaignid=mobvjcmp&from=mobviewjob&tk=1hip6m68ci82p800&fromjk=e24efc249d25548f,data science,Cairo,SAP Product Senior Manager,"Develops and executes a comprehensive product strategy for the SAP product portfolio, aligning it with business objectives and market demandsOversees the entire product development lifecycle, from concept to launch, ensuring high-quality deliverables and timely releasesGathers and analyzes client / stakeholder feedback, market trends, and competitive intelligence to identify opportunities for product improvement and differentiationCreates and manages product roadmaps, prioritizing features and enhancements based on client / stakeholder needs, industry trends, and business goalsOwns the change request process for SAP solutions already deployed in managed service engagementsOversees the application maintenance / user support for SAP productsCollaborates with internal stakeholders, including Managed Services technology development teamsMonitors and analyzes key performance metrics of the SAP product portfolio, making data-driven decisions in alignment with key stakeholdersEnsures compliance with PwC / industry standards for the SAP product portfolioStays informed about the latest SAP technologies, industry best practices, and emerging trends to enhance and innovate product offerings in the market continuously",Experience in SAP core platformsCloud / Software as a ServiceEnterprise architectureData architectureDigital transformationIT security,Strategic mindsetStakeholder managementAbility to influenceCommunicate with impactProject managementResults driven,"Line of ServiceInternal Firm ServicesIndustry/SectorNot ApplicableSpecialismIFS - Internal Firm Services - OtherManagement LevelSenior ManagerJob Description & SummaryPwC Overview:At PwC, we measure success by our ability to create the value that our clients and our people are looking for. Our reputation lies in building lasting relationships with our clients and a focus on delivering value in all we do. We’re a network of firms in 152 countries with more than 328,000 people who are committed to delivering world-class capabilities and quality in assurance, tax and advisory servicesPwC Middle East Overview:Established in the region for over 40 years, PwC Middle East employs over 10,000 people across 12 countries: Bahrain, Egypt, Iraq, Jordan, Kuwait, Lebanon, Libya, Oman, Qatar, Saudi Arabia, Palestine and the United Arab Emirates. Complementing our depth of industry expertise and breadth of skills is our sound knowledge of local business environments across the Middle East region. Our tailored solutions help our clients meet the challenges and opportunities of doing business in the Middle East market, and beyondCorporate Culture & Working Environment:Our culture is one of inclusivity and care, where we respect each other and our differences. It's one that supports collaboration, teamwork and innovation and one that embraces difference. We support everyone having a voice and feeling empowered to challenge the status quo, bringing new ideas to the tableAs PwC staff, you will have the chance to collaborate across level, line of services, and global network. Not only in terms of work, get involved too in firm-wide eventsLine of Service and Overview:Managed Services is the delivery and execution business within PwC, providing operational solutions for clients. It brings the best of PwC’s advisory capabilities, our technology expertise and operational delivery to help clients solve complex problemsJob Summary:The SAP Product Manager is responsible for overseeing the development, enhancement, and lifecycle management of SAP products used by PwC to deliver Managed Services to their clients. This role involves collaborating with cross-functional teams to understand market needs and ensure the successful delivery of SAP solutions, including but not limited to S/4 HANA, Ariba, Success FactorsRoles and Responsibilities:Develops and executes a comprehensive product strategy for the SAP product portfolio, aligning it with business objectives and market demandsOversees the entire product development lifecycle, from concept to launch, ensuring high-quality deliverables and timely releasesGathers and analyzes client / stakeholder feedback, market trends, and competitive intelligence to identify opportunities for product improvement and differentiationCreates and manages product roadmaps, prioritizing features and enhancements based on c",Full-time
Azdan,https://eg.indeed.com/cmp/Azdan?campaignid=mobvjcmp&from=mobviewjob&tk=1hip6m9frjkao803&fromjk=8f6f057729174a86,data science,Cairo,Senior NetSuite Technical Developer,"Design, Develop, and customize custom scripts, and workflows and integrate NetSuite solutions based on requirements.Design, develop and maintain customizations, extensions, and integrations in NetSuiteCreate and maintain technical documentation for solutions developedTroubleshoot and resolve technical issues related to NetSuite implementationManage project timelines and deliverables to ensure successful implementationCollaborate with other team members to develop best practices and improve development processes and gather requirements and design solutions.Mentor and provide guidance to junior developersStay up-to-date with NetSuite releases and new features.Mentor and coach junior developers.Perform unit testing, system testing, and user acceptance testing.Document technical designs, test plans, and release notes.","Bachelor's degree in Computer Science or related fieldMinimum of3 years of experiencein developing and implementing NetSuite solutionsSolid understanding ofSuiteScript, SuiteTalk, SuiteFlow, andSuiteBuilderStrong understanding ofNetSuite's architectureanddata model.Proficient inJavaScript,HTMLandCSSExperience withSuiteCommerce Advancedis a plusStrong analytical and problem-solving skillsExcellent communication and interpersonal skillsAbility to work independently and as part of a teamExperience working withAgile methodologyis a plusStrong understanding of software development life cycle (SDLC) methodologies.",,"We are looking for aSenior NetSuite Technical Developerto join our team. The ideal candidate will be responsible for developing and maintaining NetSuite solutions for our clients. The Senior NetSuite Technical Developer will work closely with the development team and clients to deliver successful implementations.Responsibilities:Design, Develop",Full-time
MigrationIT,https://eg.indeed.com/cmp/Migrationit?campaignid=mobvjcmp&from=mobviewjob&tk=1hip6mcn0k99b800&fromjk=01b20310e8706c7a,data science,Cairo,Microsoft Dynamics Developer (CRM),IndustryBankingSalary45000FieldApplications & DataField / AreaCRMJob CategoryCRM Technical Consultant (Dev)Work Experience5+ yearsCityCairoState/ProvinceAI QahirahCountryEgyptZip/Postal Code11311,"Collaborate with other software developers, business analysts, software architects and IT professionals to implement Microsoft Dynamics CRM solutions.Develop and maintain a platform roadmap.Integrate existing systems and services into the CRM architecture.Demonstrated proficiency in installing and deploying CRM Organizations, CRM entities and implementing business workflows and processes.Demonstrated proficiency in using the either the CRM SDK or plugin platforms.Demonstrated proficiency with Microsoft.NET 3.5+ development using C#.","Minimum Requirements 5 years’ experience with software development University.Degree in Computer Science or a related discipline.Experience with supporting Microsoft products (SQL Server, SharePoint, IIS, Lync) Microsoft.Certified Technology Specialist (MCTS) for Microsoft Dynamics CRM is a plus.Experience working in an agile development team.Experience with source control management systems and continuous integration/deployment environments.",Job InformationIndustryBankingSalary45000F,Full-time
ILERRA,https://eg.indeed.com/cmp/Ilerra?campaignid=mobvjcmp&from=mobviewjob&tk=1hip6mmdcissp800&fromjk=60884fb4de256b5f,data science,Cairo,Senior .NET Developer,"Plan, design, maintain and deploy software applications to meet user and business needs.Provide customer and user technical support, and monitor system performance to ensure that software programs are operating optimally.Work with analysts, IT professionals and other developers to coordinate the development process and meet project deadlines.Handle various support calls including after working hours emergenciesManaging relationships and team working – able to build and maintain effective working relationships with a range of people cross culturally i.e. USA and India.Responding promptly and professionally to bug reportsResponsible for analysis of current programs including performance, diagnosis and troubleshooting of problem programs, and designing solutions to problematic programmingDocument code consistently throughout the development process by listing a description of the program, special instructions, and any changes made in database tables on procedural, modular and database levelResearch and recommend software tools to managementReview changes in code and the environment that will affect system performance","Minimum of 5 years of related experience.Bachelor degree in Engineer or Computer ScienceFluent English written and spokenDemonstrated knowledge of: Web Technology, .NET, MVC, Window Services, WCFFlexibility – adapts and works effectively with a variety of situations, individuals or groups.Work on problems of diverse scope where analysis of data requires evaluation of identifiable factors.Planning and organizing – able to think ahead in order to establish an efficient and appropriate course of actionCreative and Analytical thinking – able to simplify complex problems, processes or projects.",,"LOCATION:Cairo, EgyptJOB DESCRIPTION:We are a technology company, headquartered in the US and our development offices located in Egypt and India, seeking a highly motivated Senior .NET Developer.RESPONSIBILITIES:Plan, design, m",Full-time
