company_name,job_link,label,city,job_name,job_description,job_requirements,additional_info,company_info,job_type
IFPRI (International Food Policy Research Institute),https://eg.indeed.com/cmp/Ifpri-(international-Food-Policy-Research-Institute)?campaignid=mobvjcmp&from=mobviewjob&tk=1hip5siog2eh5000&fromjk=45607602574be8ce,data science,Cairo,Associate Research Fellow/Research Fellow,"Conduct country-specific and cross-country research related to economic development, digital agriculture, food security and poverty reduction, and related topics.Design and supervise the implementation of household surveys.Conduct causal impact evaluations using advanced econometric techniques.Coordinate and lead research projects.Liaise with donors & senior government stakeholders on policies and projects.Publish research in peer-reviewed publications.Communicate research to a broad spectrum of stakeholders (researchers, academic, policy makers, local partners).Conducting capacity-strengthening activities.Contributing to the preparation of internal and external program reports and reviews.Supervising various research support staff and providing professional mentoring to others.","At Associate Research Fellow level - PhD in Economics, Agricultural Economics, Public Policy, or closely related social science field.Excellent knowledge of Stata.Demonstrated ability to perform critical analyses of own and others’ research.Demonstrated experience in effective interactions in a multicultural setting with other researchers and with policymakers, donors, and civil society.Willingness to travel as required.Excellent written and spoken English communication skills with demonstrated excellence in written and oral presentations.Experience working in a developing country setting",3+ years of post-PhD experience relevant to the job and demonstrated fundraising experience.Excellent publication record in peer-reviewed journals.Major external recognition within peer professional network due to publications and other leaderships activities.Demonstrated leadership skills and strong experience building and managing teams.,"Job Summary:The International Food Policy Research Institute (IFPRI) seeks a qualified candidate to serve as an Associate Research Fellow/Research Fellow for a 2-year, renewable appointment in its Development Strategy and Governance Division. This position is based in Cairo, Egypt. The candidate will play a key role in conducting research, capacity building and policy communication activities to support IFPRI’s research programs in the Middle East and North Africa and other countries. The final grade level will be determined by demonstrated experience and track record of publications.Please note that ARF appointments at IFPRI have a maximum term of three (3) years, inclusive of any approved appointment extensions. After the maximum appointment term, ARFs may be considered for a promotion to the next level.Essential Duties:Specific duties include but are not limited to:Conduct country-specific and cross-country research related to economic development, digital agriculture, food security and poverty reduction, and related topics.Design and supervise the implementation of household surveys.Conduct causal impact evaluations using advance",Full-time
Envision Employment Solutions,https://eg.indeed.com/cmp/Envision-Employment-Solutions?campaignid=mobvjcmp&from=mobviewjob&tk=1hip5smjuisst800&fromjk=4276e46a7dc73b64,data science,New Cairo,Project Manager,"Determine and define the project scope and objectives.Predict the resources needed to reach objectives and manage resources in an effective and efficient manner.Prepare a budget based on the scope of work and resource requirements.Track project costs in order to meet the budget.Develop & manage a detailed project schedule & work plan.Provide project updates on a consistent basis to various stakeholders about strategy, adjustments, and progress.Manage contracts with vendors and suppliers by assigning tasks and communicating expected deliverables.Utilize industry best practices, techniques, and standards throughout the entire project execution.Experience in managing IT Infrastructure and Security projects in banking sectorMonitor progress and make adjustments as needed.Measure project performance to identify areas for improvement.","Bachelor’s degree in computer science, computer engineering, or a related field.minimum of10years of project management and related experience.Strong technical background in IT infrastructure & security disciplines, including network, service desk, data center, infrastructure, security, and systems integration.Technical working knowledge of infrastructure technology (servers, storage, network, database, application servers, APIs, Web Services)Project Management Professional (PMP) certification is preferred.Proven ability to solve problems creatively.Strong familiarity with project management software tools, methodologies, and best practices.Experience seeing projects through the full life cycle, including implementation of IT infrastructure, Software and Security solutionsProven ability to complete projects according to the outlined scope, budget, and timeline.","Health insuranceLearning, development and career progression","Ready and hungry for a new adventure? You are definitely in the right place!We atEnvision Employment Solutionsare always on the look for top talents around the globe and matching them with our partners' hiring needs, to help them build and scale!Our partners offer awesome work environment, competitive salaries, full benefits, and many others perks.Our Hiring Process:1.After filling your online application, our team will review your application and if you are a fit for any of the open positions we have even if it wasn't the one you applied for, our team will reach out to you to schedule an HR Interview.2.During the call we will go through your resume and discuss the opportunities we have for you in details. We would love to learn a little bit about you, about your work experience and your career's goal. We will also be able to answer any questions you might have.Please feel free to share our career site with any of your colleagues or anyone you know that might be looking for a job:https://jobs.lever.co/envisionemploymentsolutions_________________________________________________________________________________________________________Envision Employment Solutionsis currently looking for aProject Managerfor one of our partners, a multinational bank.Responsibilities:Determine and define the project scope and objectives.Predict the resources needed to reach objectives and manage resources in an effective and efficient manner.Prep",Full-time
PwC,https://eg.indeed.com/cmp/Pwc?campaignid=mobvjcmp&from=mobviewjob&tk=1hip5stcliemi800&fromjk=d3f1138ceb1bfb7c,data science,Cairo,ETIC,"Migration StrategyMigration Approach and DesignMigration Mappings Specifications (Entitry Level / Attrivute Level)Design and Build of Migration Jobs using ETL, Python, SAP Migration and other tool setsOwing the technical side on the end-to-end planning, coordination and oversight of the project lifecycle including resourcing, scoping, architecting and delivery.Managing client relationships including with C-level staff, Heads of Data and Analytics, IT and Data Architects, and other business stakeholders during the lifecycle of a project.Collaborating with our wider Data and Analytics teams across the firm, whether that be locally or working with our alternative delivery teams (onshore and offshore).Taking an active role in coaching and developing skills in the team.",Configuring data pool extractions from / To the SAP / ERP / Other Systems ModelsDesign and Build of Migration JobsDesign and Build of Quality Jobs and Data Profiling,+ years of experience,"DescriptionEstablished in the region for 40 years, PwC has around 8,000 people in 12 countries across the region: Bahrain, Egypt, Iraq, Jordan, Kuwait, Lebanon, Libya, Oman, the Palestinian territories, Qatar, Saudi Arabia and the United Arab Emirates.Our regional team operates across the Middle East bringing international experience delivered within the context of the region and its culture. We can bring the collective knowledge and experience of more than 328,000 people across the entire global PwC network in advisory, assurance and tax to help you find the value you are looking for.Line of ServiceAdvisoryIndustry/SectorTechnologySpecialismAdvisory - OtherManagement LevelManagerJob Description & SummaryA career within Data and Analytics services will provide you with the opportunity to help organisations uncover enterprise insights and drive business results using smarter data analytics. We focus on a collection of organisational technology capabilities, including business intelligence, data management, and data assurance that help our clients drive innovation, growth, and change within their organisations in order to keep up with the changing nature of customers and technology. We make impactful decisions by mixing mind and machine to leverage data, understand and navigate risk, and help our clients gain a competitive edge.You’ll be joining our Data Migration team within the Data Engineering, Reporting and Analytics practice, a core part of our Data & Analytics business unit.We support our clients in delivering SAP Data Migrations across a variety of transformation projects using data migration technologie, tools and processesThe role will provide you with an opportunity to work across a portfolio of clients, with a focus on large and complex organisations. Much of our existing focus is around SAP data migrations, but this is extending to other systems.As a Data Migration Engineer, your responsibilities will include:Overseeing the design and delivery of data transformation projects with clients. This will include:Migration StrategyMigration Approach and DesignMigration Mappings Specifications (Entitry Level / Attrivute Level)Design and Build of Migration Jobs using ETL, Python, SAP Migration and other tool setsOwing the technical side on the end-to-end planning, coordination and oversight of the project lifecycle including resourcing, scoping, architecting and delivery.Managing client relationships including with C-level staff, Heads of Data and Analytics, IT and Data Architects, and other business stakeholders during the lifecycle of a project.Collaborating with our wider Data and Analytics teams across the firm, whether that be locally or working with our alternative delivery teams (onshore and offshore).Taking an active role in coaching and developing skills in the team.Duties:Configuring data ",Full-time
Orange,https://eg.indeed.com/cmp/Orange-2?campaignid=mobvjcmp&from=mobviewjob&tk=1hip5t9bfissp801&fromjk=cfdca939f711e652,data science,Smart Village,Supervisor,"Supervise the end-to-end Triple Play, Complexes & Smart Cities projects technical activities and backend functionalities to ensure high quality service and on time delivery","Analysis, planning and supervision of passive network Infrastructure implementation including but not limited to Racks, Routers, ODFs, Power Cables, Power Control Units, Armored cables, Fiber Cables","Site Management: Manage, support and document passive and material installation.","Purpose of the jobFollow the scheduled project plan by working with cross-functional technical teams throughout the project lifecycle; Manage and supervise the Triple Play project technical activities including DC preparation and handover, network component implementation as well as connectivity and service activationDuties and responsibilitiesSupervise the end-to-end Triple Play, Complexes & Smart Cities projects ",Full-time
00E1 - Grifols Egypt Plasma Der,https://eg.indeed.com/cmp/00e1---Grifols-Egypt-Plasma-Der?campaignid=mobvjcmp&from=mobviewjob&tk=1hip5tdbpkj9s800&fromjk=18705e9529444e3c,data science,مصر,Sales Manager ( Rare Disease ) ,Leading and coaching sales teamBusiness development targeting more business segmentsEfficient business and market analysis,"Manage the sales team, providing guidance, coaching, and performance feedback to",Implement effective sales processes and performance metrics to monitor individual and,"Would you like to join an international team working to improve the future of healthcare? Do you want to enhance the lives of millions of people? Grifols is a global healthcare company that since 1909 has been working to improve the health and well-being of people around the world. We are leaders in plasma-derived medicines and transfusion medicine and develop, produce and market innovative medicines, solutions and services in more than 110 countries and regions.Job objective :Leading and coaching sales teamBusiness development targeting more business segmentsEfficient business and market analysisEnvironment :Internal: GEPD Marketing, Sales & Medical Representatives, Demand Planning, GEPDManagementExternal: Healthcare Professionals, and Distribution teamsKey responsibility :A. Sales Management:Manage the sales team, providing guidance, coaching, and performance feedback tomaximise their potential and drive results.Implement effective sales processes and performance metrics to monitor individual andteam performance and drive continuous improvement.Collaborate closely with other internal teams such as marketing, operations, and supplychain to ensure seamless execution of sales initiatives.B. Business Development:Identify new business opportunities, target potential customers, and establish strategicpartnerships to expand the company's customer base.Develop and nurture long-term relationships with key clients, ensuring high customersatisfaction and repeated business.Lead negotiations and contract discussions with customers, ensuring favourable termsand ",Full-time
PwC,https://eg.indeed.com/cmp/Pwc?campaignid=mobvjcmp&from=mobviewjob&tk=1hip5tno8kjbr806&fromjk=9eac588d93633bdf,data science,Cairo,ETIC,"Perform analysis on various data sets using advanced data analytics techniques to identify fraud related trends, patterns, scenarios and other valuable business insightsUse SQL to perform extract, transformation and load for analysis and retrieval purposesDesign interactive and informative dashboards using data visualization tools such as Tableau and PowerBIDesign and implement data models for data integrity, quality control and validation controlsDesign, implement and tune data models using statistical analysis and machine learning to identify fraud typologies (payment fraud, identity theft and account takeover)Identify opportunities to enhance and optimize the existing process and reporting capabilities in order to improve both the speed and efficiencyCollaborate closely with clients to understand their business requirements related to fraud analysisContinuously monitor the threat landscape by producing actionable recommendations supported with data","Bachelor's or Master's degree in Computer Science, Data Science, Statistics, or a related field3 to 4 years of experience as a Data Analytics Consultant or similar roleExpertise in Power BI, Tableau, Alteryx, SQLSolid understanding in data modeling concepts and techniquesStrong analytical and problem-solving skills with the ability to translate complex data into meaningful insightsFamiliarity with other data analytics tools, programming languages, or statistical software is a plusDemonstrates clear and concise written and verbal communicationAbility to speak and understand Arabic and English fluentlyFlexibility to work shifts",,"DescriptionEstablished in the region for 40 years, PwC has around 8,000 people in 12 countries across the region: Bahrain, Egypt, Iraq, Jordan, Kuwait, Lebanon, Libya, Oman, the Palestinian territories, Qatar, Saudi Arabia and the United Arab Emirates.Our regional team operates across the Middle East bringing international experience delivered within the context of the region and its culture. We can bring the collective knowledge and experience of more than 328,000 people across the entire global PwC network in advisory, assurance and tax to help you find the value you are looking for.Line of ServiceInternal Firm ServicesIndustry/SectorTechnologySpecialismIFS - FinanceManagement LevelSenior AssociateJob Description & SummaryAt PwC, we are investing in our Execution Managed Services (EMS) business. EMS brings the best of PwC’s advisory capabilities and our operational delivery to help clients solve complex problems. Our Financial Crime team is a critical part of this growth priority area and we are looking for motivated individuals who have a desire/interest to support our clients in delivering some of their most critical operations and programmes. Our EMS team will work with cutting edge technology to provide specialist and complex services to our clients across the region.ResponsibilitiesAs an Anti-Fraud Threat Intelligence Analyst, you’ll work as part of a team of problem solvers, helping to solve complex business issues from strategy to execution. Responsibilities include but are not limited to:Perform analysis on various data sets using advanced data analytics techniques to identify fraud related trends, patterns, scenarios and other valuable business insightsUse SQL to perform extract, transformation and load for analysis and retrieval purposesDesign interactive and informative dashboards using data visualization tools such as Tableau and PowerBIDesign and implement data models for data integrity, quality control and validation controlsDesign, implement and tune data models using statistical analysis and machine learning to identify fraud typologies (payment fraud, identity theft and account takeover)Identify opportunities to enhance and optimize the existing process and reporting capabilities in order to improve both the speed and efficiencyCollaborate closely with clients to understand their business requirements related to fraud analysisContinuously monitor the threat landscape by producing actionable recommendations supported with dataRequirements:Bachelor's or Master's degree in Computer Science, Data Science, Statistics, or a related field3 to 4 years of experience as a Data Analytics Consultant or similar roleExpertise in Power BI, Tableau, Alteryx, SQLSolid understanding in data modeling concepts and techniquesStrong analytical and problem-solving skills with the ability to translate complex data into meaningful insightsFamiliarity with other data analytics tools, programming languages, or statistical software is a plusDemonstrates clear and concise written and verbal communicationAbility to speak and",Full-time
Roots Management Consultants,https://eg.indeed.com/cmp/Roots-Management-Consultants?campaignid=mobvjcmp&from=mobviewjob&tk=1hip5tsmdiemi800&fromjk=d61514f909e87bf6,data science,Cairo,Oracle Supply Chain Consultant,"Analyze, Design, and map Supply Chain processes across different applications such Oracle WMS (Logfire), Oracle OTM, Oracle Service Cloud, Oracle Field Service Cloud, Oracle Transport Management, and other systems (Finance, HCM, CRM, …).Maintain in depth understanding of different operational processes used across different systems and provide need support for business and technical team during partners(client\service providers) onboarding and normal business operationSupport in maintaining and configuring needed setups of different systems used to run supply chain operationsProvide functional support on key systems capabilities and how to optimize related configurations and processAct as super user for different applications and support business owners in training and business acceptance testingSupport domain architects to capturing Supply Chain key components for the different layers (Business, Data, Application, Technology)","Bachelors or Masters Degree in computer science, software engineering, computer engineering or equivalent.4-6 Years experience in Oracle Supply Chain Technologies (Fusion, WMS, OFS, OFSC, OTM)",Supply chain processesSystems administrations and configurationProcess ModelingProcess Reengineering,"Work with technical and business team to understand supply chain processes of different clients and service providers and provide needed mapping to different technical solutions used to enable ultimate supply chain setup. Also will work in implementing new acquired business and system functionalitiesResponsibilitiesAnalyze, Design, and map Supply Chain processes across different applications such Oracle WMS (Logfire), Oracle OTM, Oracle Service Cloud, Oracle Field Service Cloud, Oracle Transport Management, and ot",Permanent
Microsoft,https://eg.indeed.com/cmp/Microsoft?campaignid=mobvjcmp&from=mobviewjob&tk=1hip5tvf5jkkq800&fromjk=b1f10f256fcdd995,data science,Cairo,Data Scientist/Applied Scientist,"Collaborate with cross-functional teams to design, develop, and implement recommendation algorithms to drive content consumption for publishing partners.Optimize existing recommendation algorithms by analyzing performance metrics and user feedback, incorporating advanced machine learning techniques including generative AI techniques.","Analyze large datasets to identify patterns, trends, and content performance to improve the relevance and quality of our recommendation systems.Build predictive models using machine learning algorithms and statistical techniques to optimize content recommendations for various user segments.","Bachelor's or Master's degree in Computer Science, Statistics, Data Science, or a related field.","Microsoft Start serves personalized, engaging and diverse news and interests content to millions of customers on Windows and Edge surfaces. We want to build the world’s best content ecosystem by acquiring content from a variety of content sources. We are constantly looking to understand our content partners, their content and user engagement trends to make the right investments in growing our content corpus in a relevant direction.ResponsibilitiesAs a Data Scientist/Applied Scientist focusing on recommendation systems, you will play a pivotal role in enhancing and optimizing our recommendation algorithms within our content ecosystem. Your primary responsibilities will include:1. Algorithm Development and Enhancement:Collaborate with cross-functional teams to design, develop, and implement recommendation algorithms to drive content consumption for publishing partners.Optimize existing recommendation algorithms by analyzing performance metrics and user feedback, incorporating advanced machine learning techniques including generative AI techniques.2. Data Analysis and Modeling:Analyze large datasets to identify patterns, trends, and content performance to improve the relevance and quality of our recommendation systems.Build predictive models using machine learning algorithms and statistical techniques to optimize content recommendations for various user segments.3. Experimentation and A/B Testing:· Design and conduct A/B tests to evaluate the performance of recommendation algorithms and propose iterative improvements based on the results. · Utilize experimentation results to iterate and fine-tune models, ensuring continuous improvement and impact on key business metrics.4. Collaboration and Communication:· Work closely with product managers, engineers, and other stakeholders to understand business requirements and translate them into actionable data science initiatives. · Communicate findings, insights, and recommendations to both technical and non-technical stakeholders effectively, enabling informed decision-making.QualificationsBachelor's or Master's degree in Computer Science, Statistics, Data Science, or a related field.2-3 years of relevant work experience in data science, machine learning, or applied science, with a focus on recommendation systems.Strong programming skills in Python and experience with other programming languages like C#, C++ is a plus.Solid understanding of machine learning algorithms, generative AI technologies, statis",Full-time
CompactSoft,https://eg.indeed.com/cmp/Compactsoft?campaignid=mobvjcmp&from=mobviewjob&tk=1hip5u3bskj9b801&fromjk=4ce151dd26c29995,data science,Heliopolis,Senior ERP Technical Consultant (Microsoft Dynamics AX),Hard worker,Ability to work under stress,Self motivated,General Requirements:Hard workerAbility to work under stressSelf motivatedDedicatedWell organizedAbility to ,Full-time
