job_title,job_link,label,company_name,city_name,post_time,country_name,job_type,Experience Needed:,Career Level:,Education Level:,Salary:,job_description,job_requirements,Gender:
Native Android Developer,https://wuzzuf.net/jobs/p/bRHWVdXR4MXu-Native-Android-Developer-illa-Aggregated-Cairo-Egypt,mobile app,illa ,Cairo,10 daysago,Egypt,Full Time,Not Specified,Not specified,Not Specified,Confidential,"Understand business needs, processes, and engineering requirements/restrictions. .Design, architect, implement and OWN ILLA's Android application. .Write automated tests for all Android components. .Build reusable code for future use. .Stay up-to-date with new technology and best practices. .Ensure the performance, quality, and responsiveness of applications.","As aSr.
Android Developer,you will work on ILLA's application for the
drivers. You will be responsible for designing, architecting, and
implementing ILLA's Android application.What you’ll doUnderstand business needs, processes, and engineering requirements/restrictions.Design, architect, implement and OWN ILLA's Android application.Write automated tests for all Android components.Build reusable code for future use.Stay up-to-date with new technology and best practices.Ensure the performance, quality, and responsiveness of applications.Requirements3-5 years of solid experience in Android apps and SDKs development.Bachelor’s degree in Computer Engineering, Computer Science, or equivalent discipline.Strong problem-solving skills.Drive overall operational improvements.Strong knowledge of design patterns and Android app architectural design.Strong knowledge of the unit testing and functional testing methodologies on Android.Strong knowledge of implementing UI elements and animations.Strong knowledge of the different 3rd party SDKs available for Android.Experience working with JSON API spec structureBenefitsMedical InsuranceCareer development budget (Courses, books & conferences)Flexible working hours and the option to work from homeWork with the latest and cutting-edge technologiesExperience a great and fun work environmentBe part of a unique team that delivers world-class products",
Software Android Engineer,https://wuzzuf.net/jobs/p/mvErL4j3N4pb-Software-Android-Engineer-ROBUSTA-Aggregated-Cairo-Egypt,mobile app,ROBUSTA ,Cairo,9 daysago,Egypt,Full Time,Not Specified,Not specified,Not Specified,Confidential,"Designing and building advanced applications for the Android platform .Attending client meetings for technical consultancy, managing cross-functional development teams and being a technical mentor for your tribe .Collaborating with cross-functional teams to define, design, and ship new features .Working on bug fixing and improving application performance .Submitting and managing applications on Google Play Store .Exploring, communicating and implementing Android best practices within the organization to maximize development efficiency .Staying ahead of the game and up to date with the latest the field has to offer along contributing to your community & helping your peers","Who we areRobusta Technology Group (RTG) is a key driver of digital transformation by providing a holistic tech ecosystem. RTG works with its local and international partners to help build digital customer experiences, establish remote engineering hubs and build ventures across multiple industries and domains. In this pursuit, RTG serves as a catalyst for impact and growth through events, spaces and content focused on creating impact and growth across the different interactions.Robusta is a tech agency working with a diverse client base across different sectors & industries on implementing digital transformation programs. Engagements are typically focused on digitization of existing operations & processes and/or activation of digital customer engagement channels. With a team of 100+ tech and market consultants, robusta maintains an impactful footprint across EMEA and engages with its clients through its two key operations hubs in Egypt and Germany.Our Engineering TeamAt robusta, Engineers are craftsmen, we take pride in our skills and our target is delivering the right value to our partners. We deeply believe in the Agile & DevOps movements, and we structure and shape our systems and processes accordingly.Our growing team of 50+ Engineers organized across 7 tribes, take pride in their craft, and we are always seeking to build a robust, scalable, resilient and clean product; we deeply believe one day of good design saves us months of bad implementation.Our Android TribeWe are currently the smallest tribe within the engineering team yet proudly we can say we have a strong synergy. We do not let the smallest things just slip by and keep negative energy away from our table.What you’ll be doingAs a Software Engineer specializing in Android development, you will be a vital member of our mobile app development team. Your primary responsibility will be to design, develop, test, and maintain high-quality Android applications, contributing to the overall success of our mobile projects. Your expertise in Android development and best practices will play a crucial role in delivering innovative and user-friendly mobile solutions.Designing and building advanced applications for the Android platformAttending client meetings for technical consultancy, managing cross-functional development teams and being a technical mentor for your tribeCollaborating with cross-functional teams to define, design, and ship new featuresWorking on bug fixing and improving application performanceSubmitting and managing applications on Google Play StoreExploring, communicating and implementing Android best practices within the organization to maximize development efficiencyStaying ahead of the game and up to date with the latest the field has to offer along contributing to your community & helping your peers",
Software iOS Engineer,https://wuzzuf.net/jobs/p/qu9mgeH2xdRa-Software-iOS-Engineer-ROBUSTA-Aggregated-Cairo-Egypt,mobile app,ROBUSTA ,Cairo,8 daysago,Egypt,Full Time,Not Specified,Not specified,Not Specified,Confidential,"Design and implement robust, scalable, and maintainable iOS applications. .Collaborate with cross-functional teams to define app requirements and features. .Write clean and efficient code in Swift. .Stay updated on the latest Swift language features and best practices. .Implement visually appealing and user-friendly UIs. .Work closely with designers to translate design concepts into functional UI elements. .Integrate iOS applications with backend services and APIs. .Ensure seamless data flow between the mobile app and server. .Write unit tests and conduct code reviews to maintain code quality. .Debug and troubleshoot issues, ensuring the reliability of the iOS applications. .Identify and address performance bottlenecks in the iOS app. .Optimize the application for speed and responsiveness. .Use version control systems (e.g., Git) to manage codebase. .Collaborate with other team members, including designers and backend developers. .Create and maintain documentation for code, APIs, and development processes. .Share knowledge with team members to facilitate collaboration and onboarding.","Who we areRobusta Technology Group (RTG) is a key driver of digital transformation by providing a holistic tech ecosystem. RTG works with its local and international partners to help build digital customer experiences, establish remote engineering hubs and build ventures across multiple industries and domains. In this pursuit, RTG serves as a catalyst for impact and growth through events, spaces and content focused on creating impact and growth across the different interactions.Robusta is a tech agency working with a diverse client base across different sectors & industries on implementing digital transformation programs. Engagements are typically focused on digitization of existing operations & processes and/or activation of digital customer engagement channels. With a team of 100+ tech and market consultants, robusta maintains an impactful footprint across EMEA and engages with its clients through its two key operations hubs in Egypt and Germany.Our Engineering TeamAt robusta, Engineers are craftsmen, we take pride in our skills and our target is delivering the right value to our partners. We deeply believe in the Agile & DevOps movements, and we structure and shape our systems and processes accordingly.Our growing team of 50+ Engineers organized across 7 tribes, take pride in their craft, and we are always seeking to build a robust, scalable, resilient and clean product; we deeply believe one day of good design saves us months of bad implementation.Our iOS TribeWe are as the name tells the Apple tribe. We are the ones who enjoy experimenting around with the newest iOS. Not to forget we like to think about the overall picture, not just see the technical side of a product. Our team’s motto is if you don’t know something, just ask. Come join our Apple fans and watch the annual WWDC with us!What you’ll be doingAs a Software Engineer specializing in iOS development, you will be an integral part of our mobile app development team. You will contribute to the design, development, testing, and maintenance of high-quality iOS applications, ensuring a seamless and delightful user experience. Your expertise in iOS development and best practices will play a key role in the success of our mobile projects.Design and implement robust, scalable, and maintainable iOS applications.Collaborate with cross-functional teams to define app requirements and features.Write clean and efficient code in Swift.Stay updated on the latest Swift language features and best practices.Implement visually appealing and user-friendly UIs.Work closely with designers to translate design concepts into functional UI elements.Integrate iOS applications with backend services and APIs.Ensure seamless data flow between the mobile app and server.Write unit tests and conduct code reviews to maintain code quality.Debug and troubleshoot issues, ensuring the reliability of the iOS applications.Identify and address performance bottlenecks in the iOS app.Optimize the application for speed and responsiveness.Use version control systems (e.g., Git) to manage codebase.Collaborate with other team members, including designers and backend developers.Create and maintain documentation for code, APIs, and development processes.Share knowledge with team members to facilitate collaboration and onboarding.",
iOS Developer,https://wuzzuf.net/jobs/p/SVNsSL41eulr-iOS-Developer-Epic-Systems-Giza-Egypt,mobile app,Epic Systems ,Haram,22 daysago,Egypt,Full Time,1 to 3 years,Experienced (Non-Manager),Not Specified,Confidential,"Design and build advanced applications for the iOS platform .Collaborate with cross-functional teams to define, design, and ship new features. .Unit-test code for robustness, including edge cases, usability, and general reliability. .Work on bug fixing and improving application performance. .Continuously discover, evaluate, and implement new technologies to maximize development efficiency.","BS/MS degree in Computer Science, Engineering or a related subjectProven working experience in software developmentWorking experience in iOS developmentHave published one or more iOS apps in the app storeA deep familiarity with Objective-C and Cocoa TouchExperience working with iOS frameworks such as Core Data, Core Animation, Core Graphics and Core TextExperience with third-party libraries and APIsWorking knowledge of the general mobile landscape, architectures, trends, and emerging technologiesSolid understanding of the full mobile development life cycle",
Senior Android Developer,https://wuzzuf.net/jobs/p/KpKqWfdHAUkx-Senior-Android-Developer-Fawry-for-Banking-Technology-and-Electronic-Payments-S-A-E-Giza-Egypt,mobile app,Fawry for Banking Technology and Electronic Payments S.A.E ,6th of October,17 daysago,Egypt,Full Time,4 to 8 years,Experienced (Non-Manager),Bachelor's Degree,Confidential,"Build advanced applications for the Android platform .Work with outside data sources and APIs .Unit-test code for robustness, including edge cases, usability, and general reliability .Work on bug fixing and improving application performance .Continuously discover, evaluate, and implement new technologies to maximize development efficiency .Design and build advanced applications for the Android platform. .Collaborate with cross-functional teams to define, design, and ship new features. .Translate design documents into high-quality code.","Bachelor’s degree in computers and information or software engineering.Advanced knowledge of Java & Kotlin.Clean & readable code writing.Good understanding of OOP and SOLD principles.Proficiency with offline storage, threading and performance tuning.Conduct code reviews and Strong ability to dive deep into existing code and performs troubleshooting to identify root cause of issues.Good understanding of system, design pattern and architectural design.Effective analytical and problem-solving skills.Experience with the Gradle build system.Familiarity with version control.ITI graduates are preferred.Proven software development experience and Android skills developmentProven working experience in Android app development and (+1 year of experience)Experience with Android SDK.Experience working with remote data via REST and JSONExperience with third-party libraries and APIsSolid understanding of the full mobile development life cycle.Proven experience in developing high-quality Android appsA deep understanding of the Java, Kotlin Language.Knowledge of the open-source Android ecosystem and the libraries available for common tasks (RxJava2, Retrofit2, Kotlin, Dagger2)Strong knowledge of Android SDK, different versions of Android, and how to deal with different screen sizes.Solid understanding of the full mobile development life cycle.Familiarity with RESTful APIs to connect Android applications to back-end services.Strong knowledge of Android UI design principles, patterns, and best practices.Experience with offline storage, threading, and performance tuning.A good understanding of MVC, MVP & MVVM patterns.Knowledge of low-level C-based libraries is preferredStrong knowledge of SOLID principles and object-oriented programming concepts.Familiarity with functional, reactive programming.Familiarity with cloud message APIs and push notifications.Proficient understanding of code versioning tools, such as Git.Familiarity with continuous integration (Circle CI).Team worker.Initiative and passion.Years of experience From 4 - 8 years of experienceProblem-solving mindset",
Android Developer,https://wuzzuf.net/jobs/p/ZtNCP2oOnKRo-Android-Developer-Glamera-Cairo-Egypt,mobile app,Glamera ,Nasr City,22 daysago,Egypt,Full Time,2 to 5 years,Experienced (Non-Manager),Bachelor's Degree,Confidential,"Translate designs and wire-frames into high-quality code. .Design, build and maintain high performance, reusable, and reliable Java code. .Ensure the best possible performance, quality, and responsiveness of the application. .Identify and correct bottlenecks and fix bugs. .Help maintain code quality, organization, and automatization .In-depth understanding of key Android Frameworks, data structures, algorithms and design patterns. .Excellent Experience with Java. .Proven Software development experience in Android app development and Have published at least one original Android app. .Experience developing multi-lingual applications. .Strong knowledge of Android SDK Familiarity with cloud message APIS and push notifications understanding of Google’s Android design principles and Material Design .","BS/MS degree in Computer Science, Engineering, or a related subject.Proven software development experience and Android skills development.Proven working experience in Android app development and have published at least one original Android app.Experience in the entire app life cycle concept, design, build, deploy, test, and release to Play Store.Excellent in mobile app performance and security techniques and updates.Experience integrating with third-party SDK and server-side API.Familiar with agile methodologies.Experience with Android SDKExperience working with remote data via REST and JSONExperience with third-party libraries and APIsWorking knowledge of the general mobile landscape, architectures, trends, and emerging technologiesSolid understanding of the full mobile development life cycle",
Flutter team lead,https://wuzzuf.net/jobs/p/e5mvet9MZ32E-Flutter-team-lead-Kian-Alraqmih-Dakahlia-Egypt,mobile app,Kian Alraqmih ,Mansoura,2 monthsago,Egypt,Full Time,5 to 7 years,Manager,Not Specified,Confidential,"Work with our technical leaders to set out a vision for our mobile engineering. .Design and build advanced applications for the Android/iOS platform. .Work with cross-functional teams to define, design, and ship new features. .Responsible for supervising, managing and motivating the mobile development team. .Coach, guide and mentor mobile developers to grow into their work. .Work with outside data sources and APIs. .Work on bug fixing and improving application performance .Continuously discover, evaluate, and implement new technologies to maximize development efficiency. .Work with project managers on estimating the feasibility and complexity of new products/features. .Participate in the planning process for software development projects, and ensure meeting quality and deadlines on delivery. .Design the architecture of new products/features. .Provide best practices and make sure they are respected. .Implement the quality assurance processes. .Ensure delivering the required software quality and reliability of the entire team's output.","6+ years of experience in Mobile Development.2+ years of experience as a Mobile Development Team Leader.Bachelor Degree in Computer Science or Software Engineering.You have experience working on a number of mobile apps, preferably apps with scale.Portfolio, GitHub (or another open-source account), list of published works is a plusExcellent analytical and problem-solving skills.Strong leadership and people management skills.Helping people get better at their jobs makes you happyHigh level of working English is required",
Senior Flutter Developer,https://wuzzuf.net/jobs/p/ohfDr6qvHADZ-Senior-Flutter-Developer-DEVOPSOLUTION-Cairo-Egypt,mobile app,DEVOPSOLUTION ,Nasr City,2 monthsago,Egypt,Full Time,More than 4 years,Experienced (Non-Manager),Bachelor's Degree,Confidential,"Design, Build and develop sophisticated and highly scalable mobile apps using Flutter. .Build custom packages in Flutter using the functionalities and APIs already available in native Android and IOS. .Take ownership of the preparation, production, and timely release of the applications. .Ensure the performance, quality, and responsiveness of applications. .Continuously discover, evaluate, and implement new technologies to maximize development efficiency. .Work with outside data sources and APIs. .Follow the best practices while developing the app and also keeping everything structured and well documented. .Run functionality testing and debug code.","Qualifications:5 + Years of experience in mobile development .Experience:+ 3 years in Flutter Development.Experience in Flutter APIs and Capabilities.Experience in offline storage, threading, and performance tuning.Experience in programming SQL databases.Experience with REST/SOAP services integration.Skills with a proven track record of the well-engineered design.Experience in Git source control.Experience in Agile Development Methodologies and object-oriented design techniques and principles.Skills:Excellent written and verbal communication.Teamwork and problem-solving skills, with the ability to interact and communicate successfully with business partners and development teams.Strong analytical and estimation skills with the ability to quickly debug application problems and provide short & to long-term solutions.",
Senior Flutter Developer-Part Time,https://wuzzuf.net/jobs/p/syN4fCo1DIwW-Senior-Flutter-Developer-Part-Time-RDI-Giza-Egypt,mobile app,RDI ,Dokki,2 monthsago,Egypt,Part Time,More than 3 years,Experienced (Non-Manager),Not Specified,Confidential,"Create well designed, testable, efficient code .Participate in all phases of the development life-cycle .Assist in the preparation and production of releases of software components .Ensure designs are in compliance with specifications .Independently craft project solutions by applying solid Object-Oriented-Design principles. .Ensure the performance, quality, and responsiveness of applications. .Develop customer specific solutions and extend our own track & trace software Products .Follow established development best practices, unit test conventions and teams coding style .Follow the best practices while developing the app and also keeping everything structured and well documented. .Use CI/CD for smooth deployment. .Document the project and code efficiently. .Manage the code and project on Git in order to keep in sync with other team members and managers. .Communicate with the Project Manager regarding status of projects and suggest appropriate deadlines for new functionalities. .Ensure security guidelines are always followed while developing the app. .Validate the cloud system to ensure any new changes do not compromise security of the backend server. .Connect regularly with the Quality Assurance Specialist to deliver a stable app. .Resolve all the bugs reported by the Quality Assurance Specialist in a timely manner. .Perform time profiling and memory leaks assessment. .Execute app verification protocol. .Write tests for the App. .Following company policies and quality procedures to ensure quality product deliverables.","Must Have:Native Android and IOS: To build custom Flutter Packages.Flutter: To build cross platform mobile apps for Android, IOS and Web. This should include from making responsive UIs to efficiently query data and also manage states in an optimized manner.Firebase: Should have experience with Cloud Firestore, Push Notifications, Cloud Functions and Analytics.Git: To manage and collaborate in different projects with the rest of the team.Preferred Experience:3+ years of experience working with mobile development1-2 years experience in Flutter DevelopmentMust show your previous work.Experience in Flutter Development .Published  at least 3 apps with flutterPublished at least 1 app with android and ios is a bonus.Have experience with Flutter for both iOS and Android.Familiarity with RESTful APIsExcellent in Design pattern and architecture pattern .Knowledge of modern authorization mechanisms.",
Flutter Developer,https://wuzzuf.net/jobs/p/NityBi9Ja0zk-Flutter-Developer-Giza-Egypt,mobile app,Confidential ,Sheikh Zayed,2 monthsago,Egypt,Full Time,More than 3 years,Experienced (Non-Manager),Bachelor's Degree,10000 to 15000 EGP Per Month,"Design and Build sophisticated and highly scalable apps using Flutter. .Build custom packages in Flutter using the functionalities and APIs already available in native Android and IOS. .Ensure the performance, quality, and responsiveness of applications. .Continuously discover, evaluate, and implement new technologies to maximize development efficiency. .Follow the best practices while developing the app and also keeping everything structured and well documented.","Qualifications:Experience: 1- 2 years in Flutter Development.Experience: at least 3 years in Mobile Development.Familiarity with RESTful APIs.Excellent in design patterns and architecture patterns.Use CI/CD for smooth deployment and DevOps is a plus.Write tests for the App.Understanding of Human Interface Guidelines- Apple Developer.Understanding of Material design Guidelines - Android Developers.Published at least 2 apps with flutter.Skills:Good communication skills.Strong problem-solving skills.Team worker.Highly motivated.Initiative and passion.Very comfortable learning new technologies, tools, and platforms.",
Flutter Developer,https://wuzzuf.net/jobs/p/V545XDFXwGnO-Flutter-Developer-Osolutions-Cairo-Egypt,mobile app,Osolutions ,Nasr City,1 dayago,Egypt,Full Time,2 to 5 years,Experienced (Non-Manager),Not Specified,Confidential,"Lead and collaborate with cross-functional teams to develop, test, and deploy Flutter applications. .Design and implement efficient, reusable, and reliable code for mobile platforms. .Optimize app performance and ensure responsiveness across various devices. .Integrate external APIs and third-party libraries for enhanced functionality. .Debug and resolve technical issues, ensuring a smooth user experience. .Stay updated with the latest industry trends and emerging Flutter technologies. .Mentor and provide guidance to junior developers, fostering a collaborative work environment.","Proven experience in Flutter development with a portfolio of successful projects.Strong proficiency in Dart programming language.Expertise in UI/UX design principles and mobile app architecture.Proficient with version control systems (e.g., Git).Familiarity with RESTful APIs and integration of third-party libraries.Excellent problem-solving and debugging skills.Leadership experience or demonstrated ability to lead development teams.",
