job_title,job_link,label,company_name,city_name,post_time,country_name,job_type,Experience Needed:,Career Level:,Education Level:,Salary:,job_description,job_requirements,Gender:
Senior Backend Developer,https://wuzzuf.net/jobs/p/FE1o4CNFJ4fg-Senior-Backend-Developer-FlapKap-Cairo-Egypt,mobile app,FlapKap ,Maadi,22 daysago,Egypt,Full Time,4 to 8 years,Experienced (Non-Manager),Bachelor's Degree,Confidential,"Design, develop and test new features and maintain old ones .Optimize our codebase for quality and scalability .Enhance our practice in continuous integration, test automation and other state of the art practices .Collaborate with other team members and stakeholders .Mentor junior members of the team to grow our skill base","What skills do you need?You have the capacity to work autonomously in a rapidly changing and sometimes ambiguous environmentYou have previous experience (4+ years) developing server-side solutions at considerable scaleYou've worked with any JVM language beforeWe're confident that great engineers can quickly get up to speed, and we'll provide the support and time you need to do thatWe offer:Competitive SalariesHybrid working environmentPaid time offHealthcare coverageA highly collaborative team environment that will support your professional and personal growthA culture of learning and innovationOffice located at Maadi, Cairo",
"Frontend Developer ""React""",https://wuzzuf.net/jobs/p/tm6Nkp6itlnm-Frontend-Developer-React-Bydotpy-Cairo-Egypt,mobile app,Bydotpy ,New Cairo,2 monthsago,Egypt,Full Time,2 to 3 years,Experienced (Non-Manager),Bachelor's Degree,Confidential,"Develop and maintain web applications using React and its ecosystem. .Collaborate with other developers, designers, and stakeholders to understand and translate requirements into functional and technical solutions. .Write clean, maintainable, and efficient code following best practices and coding standards. .Perform code reviews and contribute to the continuous improvement of our codebase. .Troubleshoot and debug applications to optimize performance and resolve issues. .Participate in the full software development life cycle: planning, development, testing, and deployment. .Stay up-to-date with the latest developments in React and the JavaScript ecosystem.","with 2+ years of professional experience working with React.Strong proficiency in JavaScript (ES6+), including its latest features and best practices.Solid understanding of React and its core principles, such as component lifecycle, state management, and hooks.Experience with popular React libraries and tools, such as Redux, React Router, and Material-UI.Familiarity with RESTful APIs, GraphQL, or other data fetching methods.Knowledge of HTML5, CSS3, and CSS preprocessors like Sass or Less.Familiarity with version control systems, preferably Git.Experience with testing and debugging tools, such as Jest, React Testing Library, or Enzyme.Strong problem-solving skills and attention to detail.Excellent verbal and written communication skills.Nice-to-Have SkillsExperience with other front-end frameworks or libraries, such as Angular or Vue.js.Familiarity with mobile app development using React Native.Knowledge of performance optimization techniques for web applications.Experience with build tools and automation, such as Webpack, Babel, or Gulp.work condition:5 working days: Sunday to Thursdayworking hours 10 Am to 6 Pm.What Bydotpy Offers:A competitive salary and performance-based bonuses.A benefits package that includes social and medical insurance.An exciting company culture that encourages creativity and innovation.Professional development opportunities in a fast-growing company.Please submit your application with your resume and a brief summary of your relevant experience.",
Front End Engineer (Angular/Ionic) High Growth Startup,https://wuzzuf.net/jobs/p/CVSCMekgZvcB-Front-End-Engineer-AngularIonic-High-Growth-Startup-Deal-Cairo-Egypt,mobile app,Deal ,Cairo,1 monthago,Egypt,Full Time,More than 2 years,Experienced (Non-Manager),Bachelor's Degree,Confidential,"Implement a secure, well designed and responsive ionic web app that works on mobile and desktop.(PWA) .Build dynamic dashboards with custom tables and charts .Build and maintain updated libraries and abstractions and ensure user interface work well on all screen sizes, with cross-browser support. .Design Photoshop & illustrator files into HTML Pages .Create website layouts and user interface by using standard HTML/CSS/JS practices from designs/mockups .Assure that all user input is validated before submitting to back-end .Go through legacy code for existed projects to enhance and add more features. .Optimize application for maximum speed and scalability .Collaborate with other team members and stakeholders. .Ability to share constructive feedback with team members (pull requests reviews)","Experience with JS, CSS and SASS, ionic 5+ and Capacitor.Familiarity with Socket, Google mapsFamiliarity with Git, CI/CD, JIRA is a plusFamiliarity with Angular Universal or other SSR solutions is a plusFamiliarity with advance caching and custom lazy loading mechanisms is a plusFamiliarity with auto update solutions (live update, appflow,…) is a plus",
Sales Admin,https://wuzzuf.net/jobs/p/FVNFrY8wF0Zi-Sales-Admin-iskan-Giza-Egypt,mobile app,iskan ,Giza,1 monthago,Egypt,Full Time,0 to 1 year,Entry Level (Junior Level / Fresh Grad),Not Specified,4000 to 5000 EGP Per Month,"Provide administrative assistance to the staff, such as creating fingerprints and Coordinate check-ins and check-outs and break schedule (Create manual attendance sheet). Create users,passwords, and handle issues related to laptop programs and apps, such as CRM, sharing folders.",Communication skills.Bachelor's degreeAttention to details.Planning and organizingTime managementExcellent in Microsoft office (Word - Excel),
User Acquisition Manager,https://wuzzuf.net/jobs/p/EEAtiFHVZ8mR-User-Acquisition-Manager-Games-Factory-Talents-Riyadh-Saudi-Arabia,mobile app,Games Factory Talents. ,Riyadh,2 daysago,Saudi Arabia,Full Time,Not Specified,Not specified,Not Specified,Confidential,"Responsible for User Acquisition. .Own strategy across paid marketing channels globally including the spend and performance of important budgets. .Lead paid media planning and campaign development working within a fixed budget. .Execute campaigns across various ad platforms including In-app ad networks, Google Ads, Facebook, Apple Search Ads, TikTok, etc. .Set objectives, relevant KPIs for each campaign/channel and monitor them closely in order to adapt investment strategies, assets and content. Be able to estimate expected LTV. .Be in contact with ad network representatives and work with them to learn best practices and optimize campaigns. .Evaluate competitor UA campaigns. .Optimize and analyze campaign results on a daily basis to fine-tune budget allocations. .Partner closely with our Data & Research team to measure effectiveness, drive efficiency and develop impactful insights across the organization. .Collaborate with Brand/Creative teams on the development of all creative assets (including static/video assets used for paid channels). .Coordinate with the Brand Manager to ensure alignment across marketing strategy and prioritization.","Our client, a world-leading game studio in Riyadh, is seeking a User Acquisition Manager to own paid media, growth, and analysis to support SGS upcoming game titles. She/he will succeed in being able to acquire users from multiple traffic sources, understand how to estimate whether the traffic buys are profitable at an early stage and iterate creatives in order to improve the performances with innovative and performant digital marketing techniques in the mobile game's world.The UA Manager will utilize owned and paid channels to raise awareness and acquire an engaged user base by building and executing on user acquisition strategies for each game title. As a key strategic member of the marketing team s/he will encouraged to nurture data insights to inform and optimize marketing plans that will ultimately contribute to our continually evolving best practices.Responsibilities:Responsible for User Acquisition.Own strategy across paid marketing channels globally including the spend and performance of important budgets.Lead paid media planning and campaign development working within a fixed budget.Execute campaigns across various ad platforms including In-app ad networks, Google Ads, Facebook, Apple Search Ads, TikTok, etc.Set objectives, relevant KPIs for each campaign/channel and monitor them closely in order to adapt investment strategies, assets and content. Be able to estimate expected LTV.Be in contact with ad network representatives and work with them to learn best practices and optimize campaigns.Evaluate competitor UA campaigns.Optimize and analyze campaign results on a daily basis to fine-tune budget allocations.Partner closely with our Data & Research team to measure effectiveness, drive efficiency and develop impactful insights across the organization.Collaborate with Brand/Creative teams on the development of all creative assets (including static/video assets used for paid channels).Coordinate with the Brand Manager to ensure alignment across marketing strategy and prioritization.Requirements7+ years of experience in paid mobile app marketing with an understanding of app store optimization. Bachelor’s degree.Demonstrated ability to meet revenue goals and drive post-app install metrics.Analytical mindset. Have the ability to draw insights from data.Skilled in data synthesis and developing narratives to communicate results to Marketing, Production and Management teams.SQL knowledge.BenefitsCompetitive salary + bonus.Generous relocation budget and assistance.Rent budget provided for a year.Tuition for children to attend international school.1 x ticker per person every year to travel back home.2500 USD per year for gym or leisure.VIP health insurance.1 x month hotel expenses covered (while apartment-hunting).",
Devices Merchandising Sr. Specialist,https://wuzzuf.net/jobs/p/qReF1RqK3uBP-Devices-Merchandising-Sr-Specialist-Vodafone---Egypt-Aggregated-Cairo-Egypt,mobile app,Vodafone ,Cairo,3 daysago,Egypt,Full Time,Not Specified,Not specified,Not Specified,Confidential,"This role will be responsible for managing and executing merchandising activities related to devices. Your role will involve developing and implementing strategies to drive sales growth, optimize product placement, and enhance the overall customer experience. .Responsibilities: .- Collaborate with the devices team to develop and execute effective merchandising strategies aligned with business goals.- Conduct market research and analysis to identify customer preferences, competitor activities, and emerging trends in the devices industry.- Assist in the development of merchandising plans, including product assortments, pricing strategies, promotions, and visual merchandising guidelines.- Analyze sales data and performance metrics to evaluate the effectiveness of merchandising strategies and propose improvements.- Coordinate with retail operations and retail teams to ensure optimal product placement and visual merchandising in physical stores.- Collaborate with visual merchandisers and store design teams to create visually appealing product displays that capture customer attention and drive sales.- Ensure consistency in product presentation across various retail channels, including online platforms, mobile apps, and physical stores.- Monitor and analyze the performance of product displays, making adjustments as needed to maximize sales and customer engagement.- Collaborate with demand planning teams to forecast product demand, identify potential stock-outs, and implement replenishment strategies.- Analyze inventory reports, sales trends, and market data to identify slow-moving or excess stock and suggest appropriate actions to optimize stock levels.- Coordinate with retail teams to execute markdowns, promotions, and clearance activities to drive sales and minimize inventory holding costs.- Collaborate with portfolio, marketing, and sales teams to align merchandising activities with product launches, promotional campaigns, and sales targets.- Provide input on product selection, pricing, and promotional offers based on market insights and customer preferences.- Work closely with the creative team to develop impactful visual merchandising tools, signage, and promotional materials.- Communicate merchandising plans, guidelines, and updates to relevant stakeholders, ensuring alignment and clarity.- Monitor and analyze key performance indicators (KPIs) related to merchandising, such as sales trends, product performance, and customer feedback.- Prepare regular reports and presentations to communicate merchandising performance, identify areas for improvement, and propose actionable recommendations.- Conduct post-mortem analysis of merchandising activities, assessing their effectiveness and impact on sales and customer satisfaction.- Stay updated on industry trends, competitive landscape, and best practices in devices merchandising, incorporating relevant insights into strategies and initiatives. .Qualifications: .- Bachelor's degree in business administration, marketing, retail management, or a related field. Additional certifications or coursework in merchandising are a plus.- Proven experience in merchandising, retail operations, or product management, preferably within the devices or technology industry.","What you’ll doThis role will be responsible for managing and executing merchandising activities related to devices. Your role will involve developing and implementing strategies to drive sales growth, optimize product placement, and enhance the overall customer experience.Responsibilities:- Collaborate with the devices team to develop and execute effective merchandising strategies aligned with business goals.- Conduct market research and analysis to identify customer preferences, competitor activities, and emerging trends in the devices industry.- Assist in the development of merchandising plans, including product assortments, pricing strategies, promotions, and visual merchandising guidelines.- Analyze sales data and performance metrics to evaluate the effectiveness of merchandising strategies and propose improvements.- Coordinate with retail operations and retail teams to ensure optimal product placement and visual merchandising in physical stores.- Collaborate with visual merchandisers and store design teams to create visually appealing product displays that capture customer attention and drive sales.- Ensure consistency in product presentation across various retail channels, including online platforms, mobile apps, and physical stores.- Monitor and analyze the performance of product displays, making adjustments as needed to maximize sales and customer engagement.- Collaborate with demand planning teams to forecast product demand, identify potential stock-outs, and implement replenishment strategies.- Analyze inventory reports, sales trends, and market data to identify slow-moving or excess stock and suggest appropriate actions to optimize stock levels.- Coordinate with retail teams to execute markdowns, promotions, and clearance activities to drive sales and minimize inventory holding costs.- Collaborate with portfolio, marketing, and sales teams to align merchandising activities with product launches, promotional campaigns, and sales targets.- Provide input on product selection, pricing, and promotional offers based on market insights and customer preferences.- Work closely with the creative team to develop impactful visual merchandising tools, signage, and promotional materials.- Communicate merchandising plans, guidelines, and updates to relevant stakeholders, ensuring alignment and clarity.- Monitor and analyze key performance indicators (KPIs) related to merchandising, such as sales trends, product performance, and customer feedback.- Prepare regular reports and presentations to communicate merchandising performance, identify areas for improvement, and propose actionable recommendations.- Conduct post-mortem analysis of merchandising activities, assessing their effectiveness and impact on sales and customer satisfaction.- Stay updated on industry trends, competitive landscape, and best practices in devices merchandising, incorporating relevant insights into strategies and initiatives.Qualifications:- Bachelor's degree in business administration, marketing, retail management, or a related field. Additional certifications or coursework in merchandising are a plus.- Proven experience in merchandising, retail operations, or product management, preferably within the devices or technology industry.",
Marketing Manager,https://wuzzuf.net/jobs/p/KPFCKOOKlZ86-Marketing-Manager-dmg-events-Aggregated-Dubai-United-Arab-Emirates,mobile app,dmg events ,Dubai,8 daysago,United Arab Emirates,Full Time,Not Specified,Not specified,Not Specified,Confidential,"Create and implement an integrated marketing campaign for the entire exhibition including exhibitor, delegate and visitor campaigns .Develop marketing plan for lead generation and engage with each team to ensure optimum marketing for each aspect of the event .Forecast and monitor entire budget, marketing timeline and media plan .Use the full marketing mix to promote the exhibition and conferences in accordance with the marketing strategy from utilising below and above the line mediums including email, direct mail, PR, fax, social media, outdoor advertising, online advertising, trade and daily advertising, SMS, website, radio, search engine marketing and TV. .Manage the clean, verification and build of the show database .Negotiate barter details with appropriate media partners and associations .Ensure show websites are fully up to date with latest information. Manage the integration of any third-party modules (e.g. floorplanner, show APP, etc.) between suppliers. .Utilise and manage digital tools (i.e. App, survey tool) to enhance campaigns. .Coordinate the design, production and mail of all marketing collateral, including sales brochures, conference brochures, visitor tickets, post-cards, top line report, post-show report, print advertisements, web banners/emails, etc. .Manage PPC campaign, with support of Digital Marketing Executive – review results and make recommendations. .Provide onsite support to ensure the smooth running of marketing related activity (i.e. registration, press office, research, placement of branding and materials; sales stand).","Job Purpose:To ensure a world class level of marketing that adopts a mix of traditional and innovative tactics and strategies that reflects the position of the events This role will be expected to engage with key stakeholders across the events within the portfolio. Events include but not limited to: Global Rail Transport Infrastructure Exhibition and Conference.Key Accountabilities:Create and implement an integrated marketing campaign for the entire exhibition including exhibitor, delegate and visitor campaignsDevelop marketing plan for lead generation and engage with each team to ensure optimum marketing for each aspect of the eventForecast and monitor entire budget, marketing timeline and media planUse the full marketing mix to promote the exhibition and conferences in accordance with the marketing strategy from utilising below and above the line mediums including email, direct mail, PR, fax, social media, outdoor advertising, online advertising, trade and daily advertising, SMS, website, radio, search engine marketing and TV.Manage the clean, verification and build of the show databaseNegotiate barter details with appropriate media partners and associationsEnsure show websites are fully up to date with latest information. Manage the integration of any third-party modules (e.g. floorplanner, show APP, etc.) between suppliers.Utilise and manage digital tools (i.e. App, survey tool) to enhance campaigns.Coordinate the design, production and mail of all marketing collateral, including sales brochures, conference brochures, visitor tickets, post-cards, top line report, post-show report, print advertisements, web banners/emails, etc.Manage PPC campaign, with support of Digital Marketing Executive – review results and make recommendations.Provide onsite support to ensure the smooth running of marketing related activity (i.e. registration, press office, research, placement of branding and materials; sales stand).Qualifications and Experience:Minimum Qualifications and Knowledge: Marketing qualification is advantageous.Minimum Experience: 3+ years in mid manager level marketing, but not strictly in event marketingJob-Specific Skills:• Strategy creation and critical path analysis• Experience in the use of databases in both mass and targeted direct marketing campaigns• Experience managing the production of mobile apps and online registration systems• People management• Website user experience• Budget management, including budgetary responsibility for decision making relating to a wide variety of potential marketing channels• Strong knowledge of MS Office Suite, including: MS Word, Outlook, and Excel• Excellent interpersonal skills and the ability to effectively communicate with and relate to all levels both within and outside the organisation• Excellent negotiation and relationship building skills• Strong attention to detail• Experience using an email service supplier (ESP) including setting up HTML & plain text emailsdmg::events is an equal opportunity employer. If you have not received feedback on your submission within 14 days, please regard it as unsuccessful for the time being.",
Senior Front End Developer with Angular,https://wuzzuf.net/jobs/p/X7kr1miMLSGe-Senior-Front-End-Developer-with-Angular-CREALOGIX-Jeddah-Saudi-Arabia,mobile app,CREALOGIX ,Jeddah,15 daysago,Saudi Arabia,Full Time,Not Specified,Not specified,Not Specified,Confidential,Collaborate with other teams to ensure design and integration .Develop as per the guidance of your senior mentor .Resolve defects during QA testing and in post-release patches,"Company DescriptionCREALOGIX is a leading global FinTech software solutions provider working with some of the most innovative financial brands in the world.  We are dynamic and growing with over 600 employees around the world including Switzerland, Germany, Spain, the UK, the Middle East and Singapore.Some of the world’s largest banks and wealth management firms select and deploy our advanced SaaS and cloud-based technologies to meet their customers’ needs – and it’s our people who make the difference.Job DescriptionWe are looking for aAngular Software Engineer.The position is available immediately and can be accomplished from our office inRiyadh.You will be working with a skilled and talented team developing with the latest technologies and always with best practices.A few words from Oriol, our Head of Software Architecture in Barcelona:“Working at CREALOGIX is challenging for many reasons. Our focus is becoming the #1 global provider of Digital Banking Platforms, it means that we need to transform ourselves into a Product and People Company. Here’s where our Cross Teams take relevance and therefore we need to grow, Cross Teams are formed around specific technical interests like Frontend, Backend, Mobile and DevOps with the common goal of defining a single CODE base for Delivery Teams. We need people who wants to lead the change with us, who doesn’t want to reinvent the wheel but leverage on experience, standards and well-known best practices. If you are interested... Let’s talk!”Your mission:Collaborate with other teams to ensure design and integrationDevelop as per the guidance of your senior mentorResolve defects during QA testing and in post-release patchesQualificationsMinimum of +5 years of experience as Front End Developer with AngularExperienced in modern front end framework (Angular5+, bonus points for latest versions of Angular)Preferred development experience with Typescript.Experience with CSS preprocessors (LESS/Sass)Ability to write high-performance, reusable code for UI components.Some experience with modern responsive web design.Knowledge on Event API’sKnowledgeable with GitExperienced in Reactive programmingBroad knowledge of different components and tools available in the market and pros and cons of themNice to have:Linux, *nixNodeJS experienceFinancial services experienceExperience with WebpackExperience with web site/app securityNative and Hybrid programmingNgRx libraryAdditional InformationWe offer flexible annual working time models, part time as well as a hybrid approach to home office. At CREALOGIX we live a friendly culture with flat hierarchies, where people call each other by their first names. Come and join us in a supportive working environment with training and development opportunities on and off the job, a generous holiday entitlement and location-related benefits.CREALOGIX Group is proud to be an equal-opportunity employer. We are committed to equal employment opportunity regardless of origin, religion, age or gender. We support inclusion and welcome diversity as an essential source of strength in our global team. Please note that all our job descriptions are written gender neutral.Have we caught your attention?Don't hesitate and send us your application online. We are looking forward to it! Feel free to contact the local Recruiting Team if you have any questions.",
