job_title,job_link,label,company_name,city_name,post_time,country_name,job_type,Experience Needed:,Career Level:,Education Level:,Salary:,job_description,job_requirements,Gender:
Cross-Platform Full Stack Developer,https://wuzzuf.net/jobs/p/rNUCYnLqiEXu-Cross-Platform-Full-Stack-Developer-Dakkaken-Cairo-Egypt,mobile app,Dakkaken ,Nasr City,16 daysago,Egypt,Full Time,4 to 7 years,Experienced (Non-Manager),Not Specified,Confidential,Develop and maintain various web and mobile applications. .Ensure cross-platform optimization for mobile phones and responsiveness of applications. .Collaborate with the development team to design and launch new features. .Maintain code integrity and organization. .Understand and implement security and data protection measures. .Stay up-to-date with the latest developments in web and mobile application technology.,"Proven experience as a Full Stack Developer or similar role.Strong proficiency with front-end languages (HTML, CSS, JavaScript) and frameworks (React, Angular, Vue.js).Experience in back-end languages (Node.js, Python, Ruby, PHP) and JavaScript frameworks (React, Node.js).Familiarity with database technology (e.g., MySQL, MongoDB).Experience with cloud messaging APIs and usage of push notifications.Knowledge of code versioning tools such as Git.Excellent problem-solving skills and attention to detail.Strong organizational and project management skills.",
Full Stack (Node/React) Developer,https://wuzzuf.net/jobs/p/sI3IHTZBXkpa-Full-Stack-NodeReact-Developer-Anyware-Software-Cairo-Egypt,mobile app,Anyware Software ,Maadi,7 daysago,Egypt,Full Time,1 to 3 years,Entry Level (Junior Level / Fresh Grad),Bachelor's Degree,Confidential,Anyware Software is searching for a motivated and enthusiastic Full Stack (Node/React) Developer to develop highly sophisticated mobile apps.,"Requirements:BS/MS degree in Computer Science, Engineering.V. Good or Fluent in English.Skills and Knowledge:Strong knowledge of modern JavaScript frameworks and libraries.Real solid experiencein frontend/backend development.Strong Experience with HTML5, CSS3, JavaScript.Excellent with Node.js (Express.js or Nest.js).Strong Experience with React.js.Solid understanding of Progressive Web Applications.Web experience with developing responsive web design or applications.Experience with web services API integration.Good understanding of asynchronous requests and promises.Experience with version control such as Git.Experience with JS module patterns.Extensive experience in design patterns and SOLID principles.Google Cloud/AWS knowledge is a plus.Java knowledge is a plus.",
Software Tester,https://wuzzuf.net/jobs/p/hj999QCvBVVw-Software-Tester-RTR-Software-Solutions-Cairo-Egypt,mobile app,RTR Software Solutions  ,Nasr City,1 monthago,Egypt,Full Time,2 to 4 years,Experienced (Non-Manager),Not Specified,Confidential,"Meeting with Development Managers to discuss software specifications and controls. .Using the software as intended to analyze its functional properties. .Designing test procedures to evaluate each software product. .Building, coding, and implementing software evaluation test programs. .Running test programs to ensure that testing protocols evaluate the software correctly. .Tweaking the software testing systems for maximum performance. .Finalizing and documenting testing procedures. .Completing final tests and creating test reports. .Presenting test reports to management and suggesting software fixes. .Executing test scripts and reviewing results. .Reporting and documenting technical issues. .Review and analyze system specifications. .Execute test cases (manual or automated) and analyze results. .Evaluate product code according to specifications. .Report bugs and errors to development teams. .Conduct post-release/ post-implementation testing.Work with cross-functional teams to ensure quality throughout the software development life-cycle.","Education: computer science /related field.working on-site.Years of experience 2-4 years.Basic Concept of Programming.Proven work experience on mobile apps as well as web-based projects.Strong knowledge of software QA methodologies, tools, and processes.Experience in writing clear, concise, and comprehensive test plans and test cases.Hands-on experience with black box testing.Hands-on experience with automation testing tools.Experience with performance and security testing is a plus.Bonus Skills.Experience working in an Agile/Scrum development process.Previous experience in testing a large-scale project.",
Senior UI Developer,https://wuzzuf.net/jobs/p/guRdUNA4hNpe-Senior-UI-Developer-Giza-Egypt,mobile app,Confidential ,6th of October,1 monthago,Egypt,Full Time,3 to 7 years,Experienced (Non-Manager),Bachelor's Degree,"Confidential, Financial Stability -Social & Medical Insurance -Interesting & Challenging Projects Within Professional Teams. -Comfortable Working Environment &Friendly Team Work -Training & Development Plans, Bonus","Explore and study effective UI designs, trends, and best practices when it comes to interactions, animations, layouts, etc. .Create a vision, conceive designs, and consistently meet deadlines and requirements. .Design beautiful, intuitive interfaces for web and mobile app interfaces, while adhering to branding and design guidelines. .Translate a UX concept from wireframes and sketches into detailed UI design. .Development of responsive Frontend designs using tools such as CSS 3 or 4, Sass, HTML5, Bootstrap, Jquery, Angular JS and Angular TS. .Creating modern, interactive Frontend components with great usability based on Bootstrap and other frameworks. .Creating effective user flow and wireframes and propose new ideas. .Designing websites & mobile applications easy and effective to use. .Iterate on design in order to evaluate current UX and bring improvement to the look and feel for UX of the product. .Ensure the UI Compatibility cross defiant platform and different browsers. .Coordinate with the Architect and Senior developers to choose the best control library that should be suitable for the business case.","Proven track record in building scalable web applications.Experience working with Javascript frameworks CSS 3 or 4, Sass, HTML5, Bootstrap, Jquery, Angular JS and Angular2+.Practical experience in using Adobe Photoshop, Adobe Illustrator, and Dreamweaver is a MUST.Familiarity with RESTful APIs is a plus.Pixel perfect design sensibilities.Responsive & Adaptive design wisdom.Always helpful, Positive, Team-Oriented, and Get-Things-Done attitude.Designing websites & mobile applications.",
Senior PHP Developer (Laravel),https://wuzzuf.net/jobs/p/PIdrbLmprugO-Senior-PHP-Developer-Laravel-Our-Education-Cairo-Egypt,mobile app,Our Education ,Nasr City,25 daysago,Egypt,Full Time,3 to 5 years,Experienced (Non-Manager),Bachelor's Degree,Confidential,"We are looking for a PHP Developer responsible for managing back-end services and the interchange of data between the server and the users. .Your primary focus will be the development of all server-side logic, definition and maintenance of the central database, and ensuring high performance and responsiveness to requests from the front-end and mobile apps.","Strong knowledge of PHP web frameworks ""Laravel Mainly"".Proficient Understanding the fully synchronous behavior of PHP.Proficient Understanding of MVC design patterns.Proficient understanding of front-end technologies, such as JavaScript, HTML5, and CSS3.Good Knowledge of object-oriented PHP programming.Fair to strong knowledge of socket.io , firebase, node.js, GO lang.Understanding accessibility and security compliance.Strong knowledge of the common PHP or web server exploits and their solutions.Understanding fundamental design principles behind a scalable application.User authentication and authorization between multiple systems, servers, and environments.Integration of multiple data sources and databases into one system.Familiarity with the limitations of PHP as a platform and its workarounds.Creating database schemes that represent and support business processes.Proficient understanding of code versioning tools, such as Git.Good understanding of SEO principles and ensuring that application will adhere to them.Strong background of NginX.",
Senior Flutter Developer,https://wuzzuf.net/jobs/p/3rLuktB4bT5f-Senior-Flutter-Developer-ENCOODERS-TECHNOLOGIES-Dakahlia-Egypt,mobile app,ENCOODERS TECHNOLOGIES ,Mansoura,1 monthago,Egypt,Full Time,More than 3 years,Experienced (Non-Manager),Not Specified,Confidential,"Working from office only (Mansoura City). .Create well designed, testable, efficient code. .Participate in all phases of the development life-cycle. .Assist in the preparation and production of releases of software components. .Ensure designs are in compliance with specifications. .Independently craft project solutions by applying solid Object-Oriented-Design principles. .Independently craft project solutions by applying solid Object-Oriented-Design principles. .Ensure the performance, quality, and responsiveness of applications. .Follow established development best practices, unit test conventions and teams coding style .Use CI/CD for smooth deployment. .Document the project and code efficiently. .Manage the code and project on Git in order to keep in sync with other team members and managers. .Communicate with the Project Manager regarding status of projects and suggest appropriate deadlines for new functionalities. .Ensure security guidelines are always followed while developing the app. .Validate the cloud system to ensure any new changes do not compromise security of the backend server. .Connect regularly with the Quality Assurance Specialist to deliver a stable app. .Resolve all the bugs reported by the Quality Assurance Specialist in a timely manner. .Perform time profiling and memory leaks assessment. .Execute app verification protocol. .Following company policies and quality procedures to ensure quality product deliverables.","We are looking for Senior Flutter Developer to work from Mansoura branch on a full-time working base, with traveling opportunities to our Saudi branch.3+ years of proven experience as a flutter developer.Proficiency in the Dart programming language and the Flutter framework.Solid understanding of mobile application design patterns, UI/UX best practices, and responsive design.Experience with RESTful API design and integration.Knowledge of mobile app testing and debugging techniques.Experience with offline storage, threading, and performance tuning.Familiarity with version control systems.Excellent problem-solving skills and attention to detail.Effective communication and teamwork skills.Experience native in android and IOS.Portfolio of relevant mobile app projects and code samples.",
Backend Engineer - PHP,https://wuzzuf.net/jobs/p/83eGVW9xJybw-Backend-Engineer---PHP-Tagaddod-Aggregated-Cairo-Egypt,mobile app,Tagaddod ,Cairo,8 daysago,Egypt,Full Time,Not Specified,Not specified,Not Specified,Confidential,Develop and maintain server-side code and databases for web applications using PHP .Work with architect/senior engineers to do high-level/low-level design/architecture .Conduct code reviews and provide constructive feedback to ensure code quality and maintainability .Troubleshoot and resolve production issues and bugs .Write Unit and integration tests .Building reusable code and maintaining our current libraries for future use,"We are seeking a skilled Backend Engineer with expertise in PHP to join our Software Engineering team at Tagaddod. In this role, you will be responsible for developing and maintaining the server-side logic of our web-based applications, ensuring high performance and responsiveness to requests from the front-end and mobile apps. You will work closely with our Frontend and Mobile Engineers to build robust and scalable web and mobile applications that deliver a seamless user experience.Responsibilities:Develop and maintain server-side code and databases for web applications using PHPWork with architect/senior engineers to do high-level/low-level design/architectureConduct code reviews and provide constructive feedback to ensure code quality and maintainabilityTroubleshoot and resolve production issues and bugsWrite Unit and integration testsBuilding reusable code and maintaining our current libraries for future use",
Flutter Developer - Internship- Remotely,https://wuzzuf.net/internship/9VIVwJMLWwv8-Flutter-Developer---Internship--Remotely-Alexandria-For-Programming-Alexandria-Egypt,mobile app,Alexandria For Programming ,Bolkly,1 monthago,Egypt,Internship,0 to 1 year,Entry Level (Junior Level / Fresh Grad),Not Specified,3000 to 3000 EGP Per Month,Job Description:Flutter Mobile Developer .The intern will learn: .Flutter Ui Development .Clean Code Architecture .Consuming APISApplication Deadline: .15/1/2024 .Internship Start date: .16/1/2024 .Duration: .3 Months,Excellent software development knowledgeExcellent learning skillsGood Knowledge of Flutter & Dart,
Media Buyer,https://wuzzuf.net/jobs/p/BAQhfcFuSKz0-Media-Buyer-Tawzef-Cairo-Egypt,mobile app,Tawzef ,New Cairo,1 monthago,Egypt,Full Time,3 to 6 years,Experienced (Non-Manager),Not Specified,Confidential,"Plan, execute, and optimize Social Ad campaigns, encompassing various stages from conceptualization to budgeting and ad format selection for diverse clients. .Develop prospecting and retargeting campaigns aimed at guiding In-Market Auto Shoppers through the purchase funnel. .Drive lead generation and sales via Social Ads, ensuring a consistent brand voice across all paid platforms. .Utilize Social platforms and Google Analytics to enhance and evolve ad campaigns. .Ensure prompt and satisfactory delivery of assigned tasks to clients. .Conduct A/B tests to determine the highest-performing ad elements. .Continually monitor and enhance ad strategies, providing insights to optimize conversions and refine ad copy. .Guarantee accurate tracking and reporting consistency for clients' campaigns.","3-4 years of experience in managing social ad campaigns.Possessing a Meta BluePrint Certification is a plus.Proficiency in managing paid campaigns, re-targeting, and Facebook advertising.Profound knowledge of psychology-driven audience influence in advertising.Strong analytical skills to enhance key metrics examples CTR, CPI, CR & ROAS) Expertise in social ad creation, market segmentation, and ad implementation.Experience handling significant budgets for ads on a daily basis.A deep understanding of the complexities of Mobile ads.Extensive Knowledge of Social ads platforms (Meta- SnapchatTiktok- X - Linkedin) Familiarity with the Tracking process and set-up implementations for all previous platforms.A proven experience in App Marketing from a Digital Ads perspective.Familiarity with third-party tracking tools (Examples, Adjust Appsflyer).",
Full Stack Web Developer,https://wuzzuf.net/jobs/p/U1uaBFjiNlRl-Full-Stack-Web-Developer-IQRA-Network-Cairo-Egypt,mobile app,IQRA Network ,Cairo,8 daysago,Egypt,Full Time,3 to 5 years,Experienced (Non-Manager),Not Specified,14000 to 22000 EGP Per Month,"Create and maintain server-side application logic. .Write high quality, readable and testable code. .Design and optimize applications for high performance, high availability, and low latency.Work on security and data protection. .Work with development teams and product managers to ideate software solutions .Design client-side and server-side architecture .Build the front-end of applications through appealing visual design .Develop and manage well-functioning databases and applications .Write effective APIs .Test software to ensure responsiveness and efficiency .Troubleshoot, debug and upgrade software .Create security and data protection settings .Build features and applications with a mobile responsive design .Write technical documentation .Work with data scientists and analysts to improve software","experience building back-end services in Node.js, front-end in Angular, and databases in PostgreSQL or any other relational database experience.Must have knowledge of cloud platforms (AWS, Azure, Google cloud).Familiar with a majority of the following technologies ( Node JS, Angular, Nest JS, HTML 5, Google App Scripts, Firebase, JavaScript, jQuery, CSS, and GIT ).Knowledge of how to integrate third-party API'sKnowledge of how to incorporate different data sources and databases and how to deliver optimal output to different client platforms (mobile vs desktop).Understanding of automated unit test and testing platforms and how to implement and integrate them.Proficient in C# with a good knowledge of its ecosystemsProven experience as a Full Stack Developer or similar roleExperience developing desktop and mobile applicationsFamiliarity with common stacksKnowledge of multiple front-end languages and libraries (e.g. HTML/ CSS, JavaScript, XML, jQuery)Knowledge of multiple back-end languages (e.g. C#, Java, Python) and JavaScript frameworks (e.g. Angular, React, Node.js)Familiarity with databases (e.g. MySQL, MongoDB), web servers (e.g. Apache)Excellent communication and teamwork skillsGreat attention to detailOrganizational skillsAn analytical mindDegree in Computer Science, Statistics or relevant fieldUI/UX design is extra",
Senior Android Software Engineer,https://wuzzuf.net/jobs/p/QASDgyl3BuWc-Senior-Android-Software-Engineer-Microsoft-Aggregated-Cairo-Egypt,mobile app,Microsoft ,Cairo,8 daysago,Egypt,Full Time,Not Specified,Not specified,Not Specified,Confidential,"Our SwiftKey app empowers millions of people globally to communicate faster and more effectively with cutting-edge AI capabilities. With your help we will be able to deliver our mission at speed without compromising the stability and reliability of this integral piece of software. You’ll join us in the Mobile and Android team within the Web Experiences organisation in Cairo, where our mission is to empower every person and organization to achieve more, by focusing on building engaging content, services, experiences, and platforms for customers.This role will give you ample opportunity both to use the skills you already have, and to learn and grow in the areas most important to you, in the company of a vibrant team of other curious and capable engineers.As employees we come together with a growth mindset, innovate to empower others and collaborate to realize our shared goals. Each day we build on our values of respect, integrity, and accountability to create a culture of inclusion where everyone can thrive at work and beyond.","Our SwiftKey app empowers millions of people globally to communicate faster and more effectively with cutting-edge AI capabilities. With your help we will be able to deliver our mission at speed without compromising the stability and reliability of this integral piece of software. You’ll join us in the Mobile and Android team within the Web Experiences organisation in Cairo, where our mission is to empower every person and organization to achieve more, by focusing on building engaging content, services, experiences, and platforms for customers.This role will give you ample opportunity both to use the skills you already have, and to learn and grow in the areas most important to you, in the company of a vibrant team of other curious and capable engineers.As employees we come together with a growth mindset, innovate to empower others and collaborate to realize our shared goals. Each day we build on our values of respect, integrity, and accountability to create a culture of inclusion where everyone can thrive at work and beyond.",
Software Engineering,https://wuzzuf.net/jobs/p/shKdDYwmI0Eo-Software-Engineering-Microsoft-Aggregated-Cairo-Egypt,mobile app,Microsoft ,Cairo,9 daysago,Egypt,Full Time,Not Specified,Not specified,Not Specified,Confidential,"Our SwiftKey app empowers millions of people globally to communicate faster and more effectively with cutting-edge AI capabilities. With your help we will be able to deliver our mission at speed without compromising the stability and reliability of this integral piece of software. You’ll join us in the Mobile and Android team within the Web Experiences organisation in Cairo, where our mission is to empower every person and organization to achieve more, by focusing on building engaging content, services, experiences, and platforms for customers.This role will give you ample opportunity both to use the skills you already have, and to learn and grow in the areas most important to you, in the company of a vibrant team of other curious and capable engineers.As employees we come together with a growth mindset, innovate to empower others and collaborate to realize our shared goals. Each day we build on our values of respect, integrity, and accountability to create a culture of inclusion where everyone can thrive at work and beyond.","Our SwiftKey app empowers millions of people globally to communicate faster and more effectively with cutting-edge AI capabilities. With your help we will be able to deliver our mission at speed without compromising the stability and reliability of this integral piece of software. You’ll join us in the Mobile and Android team within the Web Experiences organisation in Cairo, where our mission is to empower every person and organization to achieve more, by focusing on building engaging content, services, experiences, and platforms for customers.This role will give you ample opportunity both to use the skills you already have, and to learn and grow in the areas most important to you, in the company of a vibrant team of other curious and capable engineers.As employees we come together with a growth mindset, innovate to empower others and collaborate to realize our shared goals. Each day we build on our values of respect, integrity, and accountability to create a culture of inclusion where everyone can thrive at work and beyond.",
Senior Software Engineer,https://wuzzuf.net/jobs/p/fpv6zFLw8clL-Senior-Software-Engineer-Microsoft-Aggregated-Cairo-Egypt,mobile app,Microsoft ,Cairo,9 daysago,Egypt,Full Time,Not Specified,Not specified,Not Specified,Confidential,"Our SwiftKey app empowers millions of people globally to communicate faster and more effectively with cutting-edge AI capabilities. With your help we will be able to deliver our mission at speed without compromising the stability and reliability of this integral piece of software. You’ll join us in the Mobile and Android team within the Web Experiences organisation in Cairo, where our mission is to empower every person and organization to achieve more, by focusing on building engaging content, services, experiences, and platforms for customers.This role will give you ample opportunity both to use the skills you already have, and to learn and grow in the areas most important to you, in the company of a vibrant team of other curious and capable engineers.As employees we come together with a growth mindset, innovate to empower others and collaborate to realize our shared goals. Each day we build on our values of respect, integrity, and accountability to create a culture of inclusion where everyone can thrive at work and beyond.","Our SwiftKey app empowers millions of people globally to communicate faster and more effectively with cutting-edge AI capabilities. With your help we will be able to deliver our mission at speed without compromising the stability and reliability of this integral piece of software. You’ll join us in the Mobile and Android team within the Web Experiences organisation in Cairo, where our mission is to empower every person and organization to achieve more, by focusing on building engaging content, services, experiences, and platforms for customers.This role will give you ample opportunity both to use the skills you already have, and to learn and grow in the areas most important to you, in the company of a vibrant team of other curious and capable engineers.As employees we come together with a growth mindset, innovate to empower others and collaborate to realize our shared goals. Each day we build on our values of respect, integrity, and accountability to create a culture of inclusion where everyone can thrive at work and beyond.",
Front End Developer React,https://wuzzuf.net/jobs/p/5shw5NpzWkkS-Front-End-Developer-React-Giza-Egypt,mobile app,Confidential ,Haram,22 daysago,Egypt,Full Time,2 to 5 years,Experienced (Non-Manager),Bachelor's Degree,Confidential,"Responsible for the design and implementation of user interfaces (UIs) and UI components using React, a front-end JavaScript library. They develop and maintain UIs for web and mobile apps.","Bachelor’s degree in computer science, information technology, or a similar field.Previous experience working as a react.js developer.In-depth knowledge of JavaScript,CSS, HTML, and front-end languages.Knowledge ofREACTtools includingReact.js, Webpack, Enzyme, Redux, and Flux.Experience with user interface design.Knowledge of performance testing frameworks including Mocha and Jest.Experience with browser-based debugging and performance testing software.Excellent troubleshooting skills.Good project management skills",
